jobId,title,job_url,branch,company,company_url,review,description,type,salary,shift,benefit,category,subcategory,expire_at,is_claimed,average_rating,number_of_jobs,third_party_apply_url
958ad37a-8160-45da-8dbc-685ce6305d0d,Coding Spec II Physician Group,https://www.indeed.com/rc/clk?jk=ae54c16a8b41e217&bb=dOl6zOEJ2hyMLdPFEMtoRuK54g-ygCq90fv3LLsue-Cr74E1f3BDHdITHNRPPG2cOs8N_a3Nloqek_b9TjmG8lpPcEasiOvpMUOI1-vK7KcAUKax4ORL2aN2b9r4b-6c&xkcb=SoCD67M3-QXVFsysTp1QbzkdCdPP&fccid=95635102d03d8328&vjs=3,unavailable,ECU Health,https://www.indeed.com/cmp/Ecu-Health?campaignid=mobvjcmp&from=mobviewjob&tk=1i2gfqqlkg05g800&fromjk=ae54c16a8b41e217,943,"ECU Health

About ECU Health Medical Center

ECU Health Medical Center, one of four academic medical centers in North Carolina, is the 974-bed flagship hospital for ECU Health and serves as the primary teaching hospital for The Brody School of Medicine at East Carolina University. ECU Health Medical Center has achieved Magnet® designation twice and provides acute and intermediate care, rehabilitation and outpatient health services to a 29-county region that is home to more than 1.4 million people.

Position Summary

Reviews medical record documentation, extracts data, and applies appropriate diagnosis and procedure codes for complex multi-specialty physician group. Coding responsibilities include inpatient hospital, outpatient hospital, and ambulatory services to support professional fee billing, internal and external reporting, research and regulatory compliance. Complies with the ICD-10-CM and CPT/HCPCS Official Guidelines for coding and reporting as well as other nationally established rules and regulations for coding assignment.

Responsibilities

Provides code assignment for all levels of Professional Fee (Physician Coding) for Inpatient, Outpatient and/or Ambulatory Services and/or Charge Entry services for large multi-specialty physician group.

Assigns diagnostic and procedural codes to patient records using ICD-10-CM and CPT/HCPCS and any other designated coding classification systems in accordance with coding guidelines.

Assigns and sequences codes accurately based on medical record documentation.

Verifies accuracy of code assignment provided by physicians and/or designated staff.

Assigns diagnosis/procedure codes utilizing the 3M Encoder to arrive at the most accurate code within designated time frame as agreed upon and/or outlined in policy.

Incorporates current regulatory coding requirements and guidelines appropriately.

Maintains weekly coding productivity log and provides feedback to the Supervisor/Manager of VMG Coding regarding any coding
issues/problems.

Maintains coding accuracy of 90% or better, in accordance with Medical Group policy.

Average number of records coded per hour must meet minimum established quantitative standards per type of patient record.

Responsible for reviewing claims and correcting Claims Manager and/or Epic edits.

Demonstrates effective computer skills for all coding functions.

Maintains confidentiality of patient information.

Participates in In-Service education, updates and conferences to remain current with coding requirements and
guidelines.

Maintains AHIMA and/or AAPC credentials.

Minimum Requirements

High School or Equivalent (GED) and one of the following AHIMA or AAPC credentials is required: RHIA, RHIT, CCS, CCS-P, CPC

Associate's Degree in Health Information Technology or Bachelor's Degree in Health Information Management is preferred.

1 - 2 years relevant coding experience required.",- Full-time,"$46,633.60 - $76,960.00 a year",unavailable,unavailable,test ,test3,12/29/2024,false,unavailable,570,https://www.indeed.com/rc/clk?jk=ae54c16a8b41e217&bb=dOl6zOEJ2hyMLdPFEMtoRuK54g-ygCq90fv3LLsue-Cr74E1f3BDHdITHNRPPG2cOs8N_a3Nloqek_b9TjmG8lpPcEasiOvpMUOI1-vK7KcAUKax4ORL2aN2b9r4b-6c&xkcb=SoCD67M3-QXVFsysTp1QbzkdCdPP&fccid=95635102d03d8328&vjs=3
4f1080ed-9dca-423e-b4f1-5650af2283c7,DRG/APC Coordinator - Coding Auditor - Remote,https://www.indeed.com/rc/clk?jk=5119458ef7747fd0&bb=dOl6zOEJ2hyMLdPFEMtoRjIRwHPTC3GvRn03kW4_eziZR2sUXTEcbLj7xZh-thkxMoCIzVBUpaGTqqbN8DTHxlGekAGz674vNRxshpjGHdlxSkc7Yo8sJY8w746X5V_j&xkcb=SoAk67M3-QXVFsysTp1VbzkdCdPP&fccid=c0d7ede21095f25a&vjs=3,unavailable,The University of Chicago Medicine,https://www.indeed.com/cmp/Uchicago-Medicine?campaignid=mobvjcmp&from=mobviewjob&tk=1i2gfr4rflvcl803&fromjk=5119458ef7747fd0,1.1K,"Job Description:

Be a part of a world-class academic healthcare system at UChicago Medicine as a DRG/APC Coordinator - Coding Auditor for the Health Information Management department. This is a remote, work from home opportunity and you may be based outside of the greater Chicagoland area.


In this role, the DRG/APC Coordinator- Coding Auditor is responsible for ensuring accuracy and quality of coding assignments for all records requiring DRG and/or APC coding; insures optimal and timely reimbursement.




Essential Job Functions:

Performs data quality reviews on inpatient and outpatient records to ensure proper coding guidelines have been followed and appropriate DRG or APC assignments have been made for appropriate reimbursement
Provides DRG/APC and coding quality information and statistical reports to the Coding Manager
Communicates with the Medical Staff and Housestaff as needed to discuss clinical questions with respect to the assignment of ICD-10-CM and ICD-10-PCS codes for diagnoses and procedures
Educates the Medical Staff and Housestaff regarding the importance of sufficient documentation to support the assignment of the appropriate DRG/APC
Reviews Hospitals' specific coding guidelines and procedures and suggests changes and updates to the Coding Manager
Participates in team meetings with coding personnel to discuss coding problems, changes, or issues
Performs routine coding and abstracting as directed
Utilizes 3M encoder optimizing function to review data for accuracy
Reviews PRO coding changes, reports findings to the Coding Manager, and - provides appropriate documentation to the PRO when appealing a PRO decision
Maintains accreditation with AHIMA and abides by the Standards of Ethical Coding as set forth by the AHIMA
Remains current on all PRO, OIG and IPPS/OPPS rules and regulations, coding updates, changes and issues


Required Qualifications:

A Bachelor’s degree from an accredited academic body or in lieu of a completed degree; equivalent experience
Registered Health Information Technician (RHIT) or Registered Health Information Administrator (RHIA), and Certified Coding Specialist (CCS) credentials
Four (4) years coding experience with a minimum of two (2) years PPS coding, DRG grouping, & APC payment experience
Three (3) years of inpatient facility coding experience
Working knowledge of 3M HDM Abstracting System and 3M Codefinder/DRG finder; must have working knowledge of JCAHO standards for chart completion
Working knowledge of medico-legal rules and regulations that govern the confidentiality and release of medical information with the ability to interpret and implement the standards; must maintain total confidentiality of all patient records
Data entry skills




Position Details:

Job Type/FTE: Full Time (1.0 FTE)
Shift: Days – 8-hour shift
Unit/Department: Health Information Management
CBA Code: Non-Union
In this role, we anticipate that you will generally work approximately 40 hours per week. We anticipate that you will generally be scheduled to work the first shift, from approximately 8am-4:30pm and will not be scheduled for on-call shifts. The days of the week that you are scheduled will not vary depending on the week and we anticipate that you will be scheduled to work on weekdays (Monday-Friday)

Must comply with UCMC’s COVID-19 Vaccination requirement as a condition of employment. If you have already received the vaccination, you must provide proof as part of the pre-employment process. This is in addition to your compliance with the Flu Vaccination requirement as well. Medical and religious exemptions will be considered consistent with applicable law. Lastly, a pre-employment physical, drug screening, and background check are also required for all employees prior to hire.
Why Join Us:
We’ve been at the forefront of medicine since 1899. We provide superior healthcare with compassion, always mindful that each patient is a person, an individual. To accomplish this, we need employees with passion, talent and commitment… with patients and with each other. We’re in this together: working to advance medical innovation, serve the health needs of the community, and move our collective knowledge forward. If you’d like to add enriching human life to your profile, The University of Chicago Medicine is for you. Here at the forefront, we’re doing work that really matters. Join us. Bring your passion.

________

Bring your career to the next level at a hospital that is thriving; from patient satisfaction to employee engagement, we are at the Forefront of Medicine. Take advantage of all we have to offer and #BringYourPassiontotheForefront.

University of Chicago Medicine is growing; discover how you can be a part of this pursuit of excellence at: www.uchospitals.edu/jobs

The University of Chicago Medical Center is an equal opportunity employer. We evaluate qualified applicants without regard to race, color, ethnicity, ancestry, sex, sexual orientation, gender identity, marital status, civil union status, parental status, religion, national origin, age, disability, veteran status and other legally protected characteristics.",unavailable,Full-time,unavailable,unavailable,test ,test3,10/19/2024,false,unavailable,415,https://www.indeed.com/rc/clk?jk=5119458ef7747fd0&bb=dOl6zOEJ2hyMLdPFEMtoRjIRwHPTC3GvRn03kW4_eziZR2sUXTEcbLj7xZh-thkxMoCIzVBUpaGTqqbN8DTHxlGekAGz674vNRxshpjGHdlxSkc7Yo8sJY8w746X5V_j&xkcb=SoAk67M3-QXVFsysTp1VbzkdCdPP&fccid=c0d7ede21095f25a&vjs=3
aded2481-c16e-4672-bff9-5a8679a13868,"Art Director, ASU Online",https://www.indeed.com/rc/clk?jk=60bdafcac05a3033&bb=dOl6zOEJ2hyMLdPFEMtoRgB1F0wYyRv3UJhBGyWUDEBkIG8RaBe0HMTZvl2JbapCD_FE9fNSymfVsjqZdUEDYYct-IeuvlDCHQgv-yKhGqG4wa-M2Mi2fXmcFirmyUu1&xkcb=SoCQ67M3-QXVFsysTp1UbzkdCdPP&fccid=2d77b0a9670ae5b7&vjs=3,unavailable,ASU Enterprise Partners,https://www.indeed.com/cmp/Asu-Enterprise-Partners?campaignid=mobvjcmp&from=mobviewjob&tk=1i2gfrd3rg05g800&fromjk=60bdafcac05a3033,5,"Art Director, Online Marketing
The ASU Outreach Hub is dedicated to connecting more constituents in impactful ways using data-derived insights, integrated and collaborative approaches and advanced outreach techniques in support of the ASU Public Enterprise.
Under the direction of the Senior Vice President of Marketing at ASU Enterprise Partners Outreach Hub, the Art Director, Online Marketing is responsible for providing hands-on art direction to ensure the delivery of best-in-class creative assets for multimedia advertising campaigns. Specializing in ASU Online marketing, one of the university’s most highly visible advertising priorities, this position is crucial in driving the creative production process.
As a member of a highly skilled team that directs the marketing strategy for top-of-funnel recruitment marketing for ASU Online, the art director draws upon extensive technical and practical knowledge of video, photography, design, and multimedia marketing, leading freelance contractors and ASU peers through the creative process, ensuring high quality production.
The art director plays a critical role in both directly developing and leading the creation of campaign-style guides, robust photo libraries, creative templates, animations, videos and advertisements. The Art Director will work closely with ASU’s Enterprise Brand Strategy and Management team to ensure full command of ASU’s brand and creative strategy.
What you’ll do:
Works with the ASU Enterprise Brand Team to ensure full command of the ASU brand platform and standards.
Routinely participate in training and creative brainstorming sessions led by the Brand team and attended by peers across ASU.
Act as a subject area expert in the area of ASU Online advertising.
Communicates with internal and external creative teams to develop ideas and efficient design systems to produce a large body of work related to multimedia advertising. Routinely prepare assets for distribution through social media, digital display, and CTV.
Lead design from concept to completion for multimedia advertising campaigns.
Fully understand the requirements of the campaign and ensure that the creative articulation meets the requirements and goals.
Engage directly in design solutions and/or provide art direction to internal and external creative resources.
Prepare for and confidently art direct on the day of photography and video shoots. Works with the photographer, stylist, crew, and models to deliver high-quality photography assets.
Produce vision boards and directional materials to ensure all team members are aligned on the quality of the photos to be produced.
Select the best photography from the set, applying insights from photography testing about which photos resonate most with ASU audiences.
Collaborates with the photographer to finalize all final art to a high level, detailed execution of color correction, retouching, and enhancement standards.
Thrive in a highly collaborative and dynamic environment that is subject to tight deadlines, often include conflicting priorities.
Hire, motivate, develop, and retain high performance team
Commit to the professional growth and development of team members
What you'll need:
Proven ability in implementing, leading, and coordinating best-in-class, branded communications (both print and electronic)
Proven ability managing a specialized or multi-disciplinary team of creatives with a leadership and professional development focus
Experience in leveraging a mix of artistic, marketing and business expertise to accomplish goals
Demonstrated expertise in human-centered, insights-driven design processes
Experience with problem solving, decision making and the ability to provide leadership in a highly collaborative environment
Experience in establishing and enacting artistic vision both on projects and for teams, leveraging and translating wide-ranging inspiration into concrete direction
Experience actively participating in constructive critique in office and in project communications
Experience in having a proactive approach to work throughout the course of a year, anticipating and proposing projects based on experience with clients
Demonstrates experience in managing multiple projects, using design to advance progress by proposing solutions and showing collaborators what is possible before final content or images are delivered
Experience in the principles, practices, methods and techniques of graphic design and layout as well as printing
Demonstrated proficiency with Adobe CS: InDesign, Illustrator, Photoshop, Acrobat
Demonstrated advanced post-production editing experience in the Adobe Creative Cloud suite (Adobe Premiere Pro, After Effects, Rush, Audition, Media Encoder, Photoshop, Lightroom and Audition)
Demonstrated experience in photo shoot direction, selection, and image manipulation
Working knowledge of digital and social mediums, and understanding of user experience
Ability to work independently, keep leadership informed of project process, and ensure alignment of creative solutions with strategic direction as developed by marketing or communication leads
Evidence of excellent communication and organizational skills, customer service focused, attention to detail, and high degree of openness to new approaches and new ideas
Ability to interpret input, feedback, and markups
Problem solver who can take initiative and set priorities while being flexible
Ability to work effectively in an environment subject to tight deadlines, which often includes conflicting priorities
Excellent leadership, team building, organizational, and relationship building skills
Ability to effectively select, hire, lead, develop, and evaluate staff
Experience establishing trust, credibility, and respect with internal and external parties
Ability to maintain a high degree of confidentiality and responsibility regarding information related to Enterprise Partners and university business
Relevant qualifications:
Bachelor’s degree in graphic design/visual communications or related field
Eight (8) years of related experience; must include three (3) years of supervisory experience
Demonstrated experience delivering campaigns across different media channels
Preferred education and experience:
Experience in an agency environment or experience working in-house for a large, established brand
Experience working with project management systems, such as Wrike or similar
Benefits:
Hybrid work schedule. We work from home two days a week!
Comprehensive benefits package, including medical, dental, and vision insurance
401(k) plan with matching employer contribution
22 days of vacation time
11 holidays, including your birthday
Parental leave
Significant tuition reductions
Professional development is highly valued at ASU Enterprise Partners, where employees are encouraged to look across the organization and nurture new areas of interest
$30 bi-weekly cell phone reimbursement

At ASU Enterprise Partners:
We serve.
We serve the faculty and staff of ASU to bring them resources so they can do all the great things that they do.
We innovate.
We’re always looking for new ideas, new solutions, new approaches and new ways to address the challenges facing ASU.
We engage.
We engage our donors, philanthropists, investors and partners, connecting them to ASU and helping them share their time, talent and treasure.
We care.
When we serve, innovate and engage, it shows that we care — about faculty, staff, donors, fellow employees and other partners as we bring resources to ASU.

ASU Enterprise Partners and its subsidiaries is an equal opportunity employer that is firmly committed to promoting justice, equity, diversity, and inclusion within our organization and throughout our sphere of influence. Because we embrace a spirit of innovation and achievement, we will endeavor to maximize the talent and potential of all employees, directors, and volunteers through bold and strategic action aimed at building success and a sense of belonging. All employees are expected to act in good faith to support these actions and to not impede the efforts of others to build a just, equitable, diverse, and inclusive organization.
ASU Enterprise Partners is an Equal Opportunity Employer",unavailable,Full-time,"Full-time, ","Benefits
Pulled from the full job description
401(k) matching
Cell phone reimbursement
Dental insurance
Health insurance
Parental leave
Vision insurance
Work from home
&nbsp;",test ,test3,11/02/2024,false,unavailable,29,https://www.indeed.com/rc/clk?jk=60bdafcac05a3033&bb=dOl6zOEJ2hyMLdPFEMtoRgB1F0wYyRv3UJhBGyWUDEBkIG8RaBe0HMTZvl2JbapCD_FE9fNSymfVsjqZdUEDYYct-IeuvlDCHQgv-yKhGqG4wa-M2Mi2fXmcFirmyUu1&xkcb=SoCQ67M3-QXVFsysTp1UbzkdCdPP&fccid=2d77b0a9670ae5b7&vjs=3
