jobId,title,job_url,branch,company,company_url,review,description,type,salary,shift,benefit,category,subcategory,expire_at,is_claimed,average_rating,number_of_jobs,third_party_apply_url
842381ff-beae-469c-97cd-16c323e24751,Data Integration Specialist,https://www.indeed.com/rc/clk?jk=3eaa8d91740f4d14&bb=dOl6zOEJ2hyMLdPFEMtoRr38nTD8zMRNn7RMt2rc1rbl9D3_y3mrtaDTuhySiNVP_1airuKr3IxQ5D8pOc7VJ96LrNiJZmHF0gc1GScSYfi1hEzRbBU101-lgxRgNEc_&xkcb=SoCm67M3-QXVFsysTp09bzkdCdPP&fccid=d719b28e5ac0660d&cmp=Win-Win-Operations&ti=Integration+Specialist&vjs=3,unavailable,Win Win Operations,https://www.indeed.com/cmp/Win-Win-Operations?campaignid=mobvjcmp&from=mobviewjob&tk=1i2gfn1u2nbl9801&fromjk=3eaa8d91740f4d14,unavailable,"ATTENTION: YOU MUST ANSWER ALL APPLICATION QUESTIONS AND SUBMIT THE REQUIRED SUBMITTALS (IF APPLICABLE) TO BE CONSIDERED FOR THIS POSITION.

ABOUT US Win Win Operations is a leading staffing firm that specializes in providing qualified professionals in various industries for government contracts. We are a small business with a nationwide reach. We are professional, agile, innovative, and our goal is to connect individuals like you with unique, career-boosting opportunities!

JOB SUMMARY We are seeking a highly skilled Data Integration Specialist to support the U.S. Marine Corps Forces, Pacific (MARFORPAC) Communication Strategy and Operations (COMMSTRAT). This role involves combining data from multiple sources, creating unified datasets, and providing actionable insights to enhance the unit’s online presence and communication strategies.

MAIN OBJECTIVES

Combine data from multiple sources or formats to create unified datasets.
Provide Boolean logic to narrow down search terms.
Predict future trends or outcomes based on historical data.
Create customizable dashboards and reports with visualizations such as charts, graphs, and heatmaps.
Use natural language processing (NLP) and machine learning algorithms to analyze sentiment.
Integrate with various data sources, including social media platforms, news websites, blogs, and forums.
Offer API access for seamless integration with other tools and platforms.
Develop custom data queries and filters to extract specific insights.

SCHEDULE OF WORK

Full-time, flexible schedule with standard working hours. Coordination with the Monitoring Specialists team to ensure seamless data integration and reporting.

PLACE OF PERFORMANCE

Fully remote position. Work can be performed anywhere with an internet connection.

PERIOD OF PERFORMANCE

Base Year: September 16, 2024 – September 15, 2025
Option Year: September 16, 2025 – September 15, 2026

QUALIFICATIONS

Proven experience in data integration and analysis.
Proficiency in natural language processing and machine learning algorithms.
Ability to create customizable dashboards and visual reports.
Strong analytical skills to interpret and analyze social media data.
Must be a U.S. citizen or Permanent Resident Alien with a verified U.S. Permanent Resident Card.
Ability to obtain DBIDS credentials and pass background checks.

REQUIRED SUBMITTALS: (Submit documents on Indeed or send directly to info@winwinoperations.com Subject: Data Integration Specialist)

Resume
Cover Letter
References
Proof of U.S. citizenship or Permanent Resident status
Any relevant certifications or training documents

COMPENSATION: Compensation is based on your qualifications and experience. Please include your compensation expectations in your application.

ADDITIONAL INFORMATION: Please apply by July 7, 2024, Noon, EST. However, feel free to apply if you are viewing this listing after the due date. Candidates can submit questions in writing via the message feature on Indeed, or directly at info@winwinoperations.com.

ATTENTION: YOU MUST ANSWER ALL APPLICATION QUESTIONS AND SUBMIT THE REQUIRED SUBMITTALS (IF APPLICABLE) TO BE CONSIDERED FOR THIS POSITION.

Job Type: Contract

Experience level:

1 year

Application Question(s):

What is your expected salary for this position?
Do you have experience in data integration and analysis? Please provide details of your relevant experience, including the tools and methods you have used.
Describe your experience with natural language processing and machine learning algorithms. What specific tools or platforms have you used?
Can you create customizable dashboards and visual reports? Please provide examples of your work in this area.

Work Location: Remote",unavailable,Contract,"Contract, ",unavailable,test ,test3,10/30/2024,false,unavailable,8,https://www.indeed.com/rc/clk?jk=3eaa8d91740f4d14&bb=dOl6zOEJ2hyMLdPFEMtoRr38nTD8zMRNn7RMt2rc1rbl9D3_y3mrtaDTuhySiNVP_1airuKr3IxQ5D8pOc7VJ96LrNiJZmHF0gc1GScSYfi1hEzRbBU101-lgxRgNEc_&xkcb=SoCm67M3-QXVFsysTp09bzkdCdPP&fccid=d719b28e5ac0660d&cmp=Win-Win-Operations&ti=Integration+Specialist&vjs=3
e8cd4b7d-97ab-4dca-b2cc-4605577c72ea,Vital Records Informaticist,https://www.indeed.com/rc/clk?jk=1383cfee4b5e7943&bb=dOl6zOEJ2hyMLdPFEMtoRmHoLQmV2ybD-cy9wSPISdboHFOFvsrHork7QYPQTCK5gtUE742gX-PjEIU9Bg9LOgo5NztfB0_eSlIdnVbOkkIHWjm7_qrTzbrPAth2tGNi&xkcb=SoD767M3-QXVFsysTp0zbzkdCdPP&fccid=79d8250a34f45646&vjs=3,unavailable,Michigan Public Health Institute (MPHI),https://www.indeed.com/cmp/Mphi-1?campaignid=mobvjcmp&from=mobviewjob&tk=1i2gfnad5khtq800&fromjk=1383cfee4b5e7943,35,"MPHI is a Michigan-based and nationally engaged, non-profit public health institute. We are a team of teams, process and content experts, dedicated to building A world where tomorrow is healthier than today!


Title: Vital Records Informaticist
$23.90 - $37.46 / Posted Thru: 7-14-24


Location: Remote/Virtual - Must Live and Work In Michigan


Purpose: This position provides informatics and statistical support to the Michigan Department of Health and Human Services (MDHHS) Division for Vital Records and Health Statistics (DVRHS) Data Development Section on a range of matters concerning data collection, processing, and dissemination. This position serves as a key resource working to modernize DVRHS data dissemination to increase the effectiveness of public health data reported on the internet. The position will work closely with DVRHS statisticians, DTMB, and MDHHS public health data strategists to develop and implement standards for web-based statistical reporting.


Duties and Responsibilities:
Develop and deploy interactive statistics dashboards for cancer, birth defects, and vital statistics to the internet.
Develop interactive visualizations of statistical data using products such as Tableau, PowerBI, R, SAS, and others.
Work with division statisticians to design content and presentation, then work with MDHHS Compliance and Communications, as well as DTMB, to deploy content to the internet.
Develop feedback and reports to data providers such as hospital birth clerks, funeral directors, and physicians.
Assist with the implementation of advanced registration system interfaces with hospital electronic health records using standards such as HL7 FHIR.
Lead the organization of DVRHS information assets on the internet across cancer, birth defects, and vital statistics staff, providing a cohesive and logical organization and presentation of data.
Use modern informatics techniques such as knowledge graphs, ontologies, and machine learning to improve the ability of the public to locate relevant information on DVRHS websites.
Work with registration staff to develop and implement quality reports to data reporters such as hospital birth clerks, funeral directors, physicians, and medical examiners.
Always represent the best interests of MDHHS and MPHI.
Other duties as assigned.


Qualifications/Requirements:


Education: Possession of a bachelor’s degree in any major. Possession of a Master of Public Health (MPH) degree with training and experience in public health informatics, including standards and terminologies used in public health is highly preferred.


Experience: Public health informatics, information systems evaluation, statistical reporting using tools such as Tableau, PowerBI, SAS, and R.


Important Skills and Characteristics:


Excellent written and verbal communication skills.
Excellent attendance record.
Ability to work independently and as a team.
Must be proficient in computer software applications including SAS, Microsoft Excel, and Word. Knowledge of standard software such as PowerPoint, and ArcGIS.
Ability to establish and maintain cooperative working relationships with health care professionals, key stakeholders, and internal departments.
Effectively work with individuals with differing backgrounds and varying levels of education.
Operate a personal computer, database, software, videoconference, and other relevant technology.
Knowledge of the principals and methods of epidemiology, biostatistics, and public health surveillance.
Knowledge of the methods used to organize, analyze, and maintain large and complex data sets.
Knowledge of the principals of birth defects and cancer surveillance preferred.
Ability to maintain privacy and security of data.


Work Environment and Physical Requirements: Position is designated as sensitive requiring periodic security clearance and background check (prior to hire). Must possess valid Michigan vehicle operator’s license or ability to independently arrange for transportation where needed to perform duties of the position. The Informaticist position is located in Lansing, MI and is housed in the Office of the Michigan Department of Health and Human Services Division for Vital Records and Health Statistics. Request for remote worksite agreements require supervisor approval. If remote work schedule agreement is approved by supervisor, the incumbent must be available to work onsite at the Office as needed and/or as required by supervisor. The incumbent will not be compensated for using personal equipment or receive reimbursement for travel and meals if the remote work site agreement is approved and the incumbent is required to report to the Office.


RESPONSIBILITY FOR THE WORK OF OTHERS: No assigned responsibility.


IMPACT ON PROJECTS, SERVICES AND OPERATIONS: The individual in this position is responsible for a variety of activities in the Michigan Department of Health and Human Services, Division for Vital Records and Health Statistics. The Data Development Section is responsible for all aspects of data collection, cleaning, and reporting for vital events in Michigan. This position is key to improving quality of data received during registration and reported to stakeholders.


REQUIRED COMMUNICATION


Contact Person/Group Frequency Purpose
Data Development Manager Weekly Website Operations
DVRHS Statisticians Weekly Projects
Other Data Development Staff Weekly Section Operations
Vital Records and Health Statistics Staff Occasionally Division Operations
Cancer Prevention and Control Program Occasionally Collaboration
Division of Lifecourse Epidemiology & Genomics Occasionally Collaboration
MDHHS Epidemiology & Population Health Staff Occasionally Collaboration


“For purposes of employment standards, this classification is “Non-Exempt” from overtime provisions of the fair Labor Standards Act.”


MPHI works with you to promote health for everyone. Together, we will build a world where tomorrow is healthier than today!
MPHI is an EEO/AA employer that participates with e-verify.",- Full-time,$23.90 - $37.46 an hour,"$23.90 - $37.46 an hour, ",unavailable,test ,test3,11/17/2024,false,unavailable,9,https://www.indeed.com/rc/clk?jk=1383cfee4b5e7943&bb=dOl6zOEJ2hyMLdPFEMtoRmHoLQmV2ybD-cy9wSPISdboHFOFvsrHork7QYPQTCK5gtUE742gX-PjEIU9Bg9LOgo5NztfB0_eSlIdnVbOkkIHWjm7_qrTzbrPAth2tGNi&xkcb=SoD767M3-QXVFsysTp0zbzkdCdPP&fccid=79d8250a34f45646&vjs=3
073bda49-d5c5-4965-8f90-29c54233aca0,Coder I,https://www.indeed.com/rc/clk?jk=bb391b09663eb0cf&bb=dOl6zOEJ2hyMLdPFEMtoRqkl5Kf3YPn4MUWkfPnRNhzMNFLDcTdkMbOqDEX2HrK3hDj8pH5Nr2_HpaK63xZwEngbO_0sFSbhE4-kW1uRvtX3sPMRzb42mAwUWs3N12AY&xkcb=SoBm67M3-QXVFsysTp0wbzkdCdPP&fccid=e309b8a71206cc5c&vjs=3,unavailable,Dignity Health Medical Group,https://www.indeed.com/cmp/Dignity-Health?campaignid=mobvjcmp&from=mobviewjob&tk=1i2gfnka7nj9q801&fromjk=bb391b09663eb0cf,3.5K,"Overview

Dignity Health Medical Foundation established in 1993 is a California nonprofit public benefit corporation with care centers throughout California. Dignity Health Medical Foundation is an affiliate of Dignity Health - one of the largest health systems in the nation - with hospitals and care centers in California Arizona and Nevada. Today Dignity Health Medical Foundation works hand-in-hand with physicians and providers throughout California to provide comprehensive health care services to the many communities we serve. As Dignity Health Medical Foundation continues to grow and establish new premier care centers we provide increasing support and investment in the latest technologies finest physicians and state-of-the-art medical facilities. We strive to create purposeful work settings where staff can provide great care while advancing in knowledge and experience through challenging work assignments and stimulating relationships. Our staff is well-trained and highly skilled qualities that are vital to maintaining excellence in care and service.

Responsibilities

***This position is remote within California.

Position Summary:

The Coder I reviews and processes clinic professional charges for Dignity Health Medical Foundation. This position works closely with medical group's physicians and providers to ensure all services billed are supported by the documentation and correctly coded for maximum reimbursement.

Responsibilities may include:

Applies coding principles consistent with government regulatory standards payer specific guidelines and Dignity Health Medical Foundation policy.
Codes Primary Care Radiology and Hospitalist professional charges for assigned providers.
Reviews all ICD E&M CPT and HCPCS codes to ensure documentation supports all services rendered.
Queries providers as needed when encounters lack clear documentation or when missing documentation is discovered in the medical record.
Provides education to physicians and providers on coding and documentation as needed.
Assists clinic and other department staff with coding related questions pertaining to assigned providers.
When requested codes missing charges identified for assigned providers.
Attends clinic and other department meetings to act as a coding resource for assigned providers.
Maintains a current working knowledge of E&M CPT and ICD coding guidelines.
Meets production and quality standards set by Physician Coding leadership.
When requested reviews and corrects coding related denials to maximize reimbursement.
When requested works all patient coding dispute inquiries in designated time periods.
All other duties as assigned.

Qualifications

Minimum Qualifications:

One (1) year or less of professional fee coding experience
High school diploma or equivalent
CPC CPC-A or CCS-P Certification

Preferred Qualifications:

GECB/IDX and Cerner

Pay Range
$25.25 - $36.61 /hour",- Full-time,$25.25 - $36.61 an hour,"$25.25 - $36.61 an hour, ",unavailable,test ,test3,02/08/2025,false,unavailable,2.4K,https://www.indeed.com/rc/clk?jk=bb391b09663eb0cf&bb=dOl6zOEJ2hyMLdPFEMtoRqkl5Kf3YPn4MUWkfPnRNhzMNFLDcTdkMbOqDEX2HrK3hDj8pH5Nr2_HpaK63xZwEngbO_0sFSbhE4-kW1uRvtX3sPMRzb42mAwUWs3N12AY&xkcb=SoBm67M3-QXVFsysTp0wbzkdCdPP&fccid=e309b8a71206cc5c&vjs=3
9348cd49-ae3c-4dad-9bf6-e886bcc32dfe,Inpatient Facility Coder,https://www.indeed.com/rc/clk?jk=6be4ee8a19d4b19e&bb=dOl6zOEJ2hyMLdPFEMtoRspcyzgXg9IqzbjFgR1n-B9bMJyeirgnBJSDzQpa3x3mhQhtG78vddQTc575TZ7SUyyRCSoWvZEMevSowF_p9hkRFvXvFD2xzcCAhCuQqx8B&xkcb=SoBc67M3-QXVFsysTp02bzkdCdPP&fccid=dd616958bd9ddc12&vjs=3,unavailable,unavailable,unavailable,unavailable,"iMedX is accepting applications for experienced inpatient facility coders. Facility coders worked on behalf of facilities and have extensive experience with DRG-based reimbursement for inpatient coding. This position does not apply to those pro-fee coders who have expertise in coding for physicians attending to patients in inpatient care.

Full-time, part-time, and independent contractor status will be considered. Applicants must have a minimum of 3 years of broad-based acute care inpatient coding experience and have the requisite credentials to demonstrate compliance with this requirement. This is a remote (work-from-home) position.

Purpose:

The Medical Coding Specialist abstracts clinical information from health records and assigns accurate and complete codes in accordance with Official Guidelines for Coding and Reporting and iMedX standards as appropriate.

Organizational Structure: The Coding Specialist reports to the Coding Manager.

Key Responsibilities:

Abstracts relevant clinical information from the health records.
Identifies the principal and secondary diagnoses based on the Official Guidelines for Coding and Reporting (OGCR)
Assigns ICD-10-CM codes to the principal and secondary diagnoses.
Identifies ICD-10-PCS codes for procedures based on OGCR.
Possesses thorough understanding of the impact of DRG-based reimbursement on inpatient coding.
Able to identify instances where a physician query is necessary for accurate code assignment and demonstrates ability to compose required objective queries
Has sufficient knowledge regarding Clinical Documentation Improvement (CDI) strategies to effectively communicate with Facility CDI staff in promotion of their initiatives.
Exhibits familiarity with facility data systems such as EPIC, Cerner, MediTech and CPSI.
Exhibits working knowledge and familiarity with encoders such as 3M and TruCODE.
Meets or exceeds the iMedX coding quality standards.
Understands and adheres to all requirements related to coding compliance.
Performs coding in an efficient and productive manner, utilizing good time management and professional work habits. Meets productivity standards for position.
Refers coding questions to the Coding Manager in a timely manner for feedback and coding guideline development.
Continually enhances coding skills. Participates in team meetings and educational conferences to ensure coding practice remains current.
Maintains confidentiality and safeguards the privacy of protected health information (PHI).
Promotes the Company’s values.
Performs other job related duties as may be assigned or required.

Education: High school diploma or GED equivalent. Completion of a formal coding program. Certified Coding Specialist (CCS), Registered Health Information Administrator (RHIA), Registered Health Information Technician (RHIT), or other AHIMA or AAPC approved coding credential preferred.

Experience: Minimum of three years’ coding work experience and working knowledge of the ICD coding system; medical terminology; anatomy and physiology; and health record content. Exhibits a sense of urgency towards work, possesses intermediate level computer skills, attention to detail, excellent customer service and written and verbal communication skills.

T7yUH8t0ZD",unavailable,Full-time,"Full-time, ",unavailable,test ,test3,01/31/2025,false,unavailable,unavailable,https://www.indeed.com/rc/clk?jk=6be4ee8a19d4b19e&bb=dOl6zOEJ2hyMLdPFEMtoRspcyzgXg9IqzbjFgR1n-B9bMJyeirgnBJSDzQpa3x3mhQhtG78vddQTc575TZ7SUyyRCSoWvZEMevSowF_p9hkRFvXvFD2xzcCAhCuQqx8B&xkcb=SoBc67M3-QXVFsysTp02bzkdCdPP&fccid=dd616958bd9ddc12&vjs=3
5c3427ff-6bc4-4b03-9d13-c95fbc1acf84,Pro Fee Coding Specialist (full-time),https://www.indeed.com/rc/clk?jk=0e67043b7b8dbe06&bb=dOl6zOEJ2hyMLdPFEMtoRmlsiXniaCOdZ2-OCI4lDpSowGZ_Kqs2f--zs1BXlULBUt54fM10UlbKkfgQea5mEctwxLL3TTbNO45265cR9BfwR-HSanBUhSj9Df8wF2Of&xkcb=SoA567M3-QXVFsysTp1MbzkdCdPP&fccid=b592ec6b1e4771b6&vjs=3,unavailable,Saint Francis Health System,https://www.indeed.com/cmp/Saint-Francis-Health-System?campaignid=mobvjcmp&from=mobviewjob&tk=1i2gfnvv7n58v8ac&fromjk=0e67043b7b8dbe06,522,"Full Time
This position may be eligible for a $2,500 sign-on bonus based on candidate eligibility.
Hours: The scheduling for this position is flexible but employees must work at least 40 hours per week. Weekends and evenings may qualify for additional shift differentials.
Job Summary: The Pro Fee Coding Specialist performs diagnosis and/or procedural coding as assigned in order to apply the appropriate diagnosis and procedural codes to individual patient health information for data retrieval, analysis, and claims processing.

Minimum Education: Commensurate education with achieving qualifications to sit for Certification Exam(s) as related to ICD-10, CPT and other related specialty certifications.

Licensure, Registration and/or Certification: Certified Coder through AAPC, AHIMA, BCHH-C, HCCS for Home Health or National Healthcare Association. Applicants who have not yet achieved a coding certification may be considered when work experience is at least two years. The applicant will need to obtain the certification within one year of hire.

Work Experience: 0 - 2 years related experience including a demonstrated thorough understanding of the content of the medical record in order to be able to locate information to support or provide specificity for coding. Requires experience and/or training in the anatomy and physiology of the human body and disease processes in order to understand the etiology, pathology, symptoms, signs, diagnostic studies, treatment modalities, and prognosis of diseases and procedures to be coded.

Knowledge, Skills and Abilities: Basic computer and encoder skills. Effective interpersonal, oral and written communication skills. Ability to organize and prioritize work in an efficient and effective manner. Uses good judgment when determining whether a record is complete enough to code or should be held for more documentation. Ability and requires maintaining continuing education credits for credentialed coders, stays updated on coding rules, attends seminars and reviews and coding periodicals. Ability to be cooperative, dependable and responsive to the changing nature of the coding workflow. Ability to be flexible when asked to do different assignments.

Essential Functions and Responsibilities: Codes as assigned from review of medical record documentation. Applies knowledge of current coding and billing requirements to assure claims are submitted correctly. Monitors coding and billing performance and resolves denials related to coding errors. Performs review for charge corrections and rebilling as required for resolution of coding denials. Develops preventative measures in response to patterns identified through analysis of claims denial data; prepares periodic reports for clinical staff, identifying corrective measures to resolve denial problems. Advises and instructs providers regarding documentation and billing policies, procedures and regulations; interacts with providers regarding conflicting, ambiguous or none-specific documentation, obtaining clarification of same. Educates provides and office staff regarding documentation coding and billing changes and regulations to assure compliance with local, state and national policies. Works collaboratively with providers, office staff, billing personnel, quality department and compliance, and coding resources to ensure accurate coding.

Decision Making: Independent judgment in planning sequence of operations and making minor decisions in a complex technical or professional field.

Working Relationships: Works with internal customers via telephone or face to face interaction. Works with other healthcare professionals and staff.

Special Job Dimensions: None.
Supplemental Information: This document generally describes the essential functions of the job and the physical demands required to perform the job. This compilation of essential functions and physical demands is not all inclusive nor does it prohibit the assignment of additional duties.
#GENIND
Health Information Ambulatory Coding - Yale Campus
Location:
Tulsa, Oklahoma 74136
EOE Protected Veterans/Disability",unavailable,Full-time,unavailable,unavailable,test ,test3,03/08/2025,false,unavailable,439,https://www.indeed.com/rc/clk?jk=0e67043b7b8dbe06&bb=dOl6zOEJ2hyMLdPFEMtoRmlsiXniaCOdZ2-OCI4lDpSowGZ_Kqs2f--zs1BXlULBUt54fM10UlbKkfgQea5mEctwxLL3TTbNO45265cR9BfwR-HSanBUhSj9Df8wF2Of&xkcb=SoA567M3-QXVFsysTp1MbzkdCdPP&fccid=b592ec6b1e4771b6&vjs=3
