jobId,title,job_url,branch,company,company_url,review,description,type,salary,shift,benefit,category,subcategory,expire_at,is_claimed,average_rating,number_of_jobs,third_party_apply_url
a72c1ae8-1433-4714-803c-d5a2cc254388,"Art Director, ASU Online",https://www.indeed.com/rc/clk?jk=60bdafcac05a3033&bb=jnCtIS6FdS9BzfPNvxIIjv600kCG4Q5StayfBAKVvhqizOKvuOLVmlpZfQ1uQbzM-2nh3Ory8Mb9hF-Hoy7O_kB_N0ZOOJ2K5arNIdzzAlsj6StI8nFBjIoN63PIfM4h&xkcb=SoB167M3-QoQBi1r950DbzkdCdPP&fccid=2d77b0a9670ae5b7&vjs=3,unavailable,ASU Enterprise Partners,https://www.indeed.com/cmp/Asu-Enterprise-Partners?campaignid=mobvjcmp&from=mobviewjob&tk=1i2gg9rodnbl980r&fromjk=60bdafcac05a3033,5,"Art Director, Online Marketing
The ASU Outreach Hub is dedicated to connecting more constituents in impactful ways using data-derived insights, integrated and collaborative approaches and advanced outreach techniques in support of the ASU Public Enterprise.
Under the direction of the Senior Vice President of Marketing at ASU Enterprise Partners Outreach Hub, the Art Director, Online Marketing is responsible for providing hands-on art direction to ensure the delivery of best-in-class creative assets for multimedia advertising campaigns. Specializing in ASU Online marketing, one of the university’s most highly visible advertising priorities, this position is crucial in driving the creative production process.
As a member of a highly skilled team that directs the marketing strategy for top-of-funnel recruitment marketing for ASU Online, the art director draws upon extensive technical and practical knowledge of video, photography, design, and multimedia marketing, leading freelance contractors and ASU peers through the creative process, ensuring high quality production.
The art director plays a critical role in both directly developing and leading the creation of campaign-style guides, robust photo libraries, creative templates, animations, videos and advertisements. The Art Director will work closely with ASU’s Enterprise Brand Strategy and Management team to ensure full command of ASU’s brand and creative strategy.
What you’ll do:
Works with the ASU Enterprise Brand Team to ensure full command of the ASU brand platform and standards.
Routinely participate in training and creative brainstorming sessions led by the Brand team and attended by peers across ASU.
Act as a subject area expert in the area of ASU Online advertising.
Communicates with internal and external creative teams to develop ideas and efficient design systems to produce a large body of work related to multimedia advertising. Routinely prepare assets for distribution through social media, digital display, and CTV.
Lead design from concept to completion for multimedia advertising campaigns.
Fully understand the requirements of the campaign and ensure that the creative articulation meets the requirements and goals.
Engage directly in design solutions and/or provide art direction to internal and external creative resources.
Prepare for and confidently art direct on the day of photography and video shoots. Works with the photographer, stylist, crew, and models to deliver high-quality photography assets.
Produce vision boards and directional materials to ensure all team members are aligned on the quality of the photos to be produced.
Select the best photography from the set, applying insights from photography testing about which photos resonate most with ASU audiences.
Collaborates with the photographer to finalize all final art to a high level, detailed execution of color correction, retouching, and enhancement standards.
Thrive in a highly collaborative and dynamic environment that is subject to tight deadlines, often include conflicting priorities.
Hire, motivate, develop, and retain high performance team
Commit to the professional growth and development of team members
What you'll need:
Proven ability in implementing, leading, and coordinating best-in-class, branded communications (both print and electronic)
Proven ability managing a specialized or multi-disciplinary team of creatives with a leadership and professional development focus
Experience in leveraging a mix of artistic, marketing and business expertise to accomplish goals
Demonstrated expertise in human-centered, insights-driven design processes
Experience with problem solving, decision making and the ability to provide leadership in a highly collaborative environment
Experience in establishing and enacting artistic vision both on projects and for teams, leveraging and translating wide-ranging inspiration into concrete direction
Experience actively participating in constructive critique in office and in project communications
Experience in having a proactive approach to work throughout the course of a year, anticipating and proposing projects based on experience with clients
Demonstrates experience in managing multiple projects, using design to advance progress by proposing solutions and showing collaborators what is possible before final content or images are delivered
Experience in the principles, practices, methods and techniques of graphic design and layout as well as printing
Demonstrated proficiency with Adobe CS: InDesign, Illustrator, Photoshop, Acrobat
Demonstrated advanced post-production editing experience in the Adobe Creative Cloud suite (Adobe Premiere Pro, After Effects, Rush, Audition, Media Encoder, Photoshop, Lightroom and Audition)
Demonstrated experience in photo shoot direction, selection, and image manipulation
Working knowledge of digital and social mediums, and understanding of user experience
Ability to work independently, keep leadership informed of project process, and ensure alignment of creative solutions with strategic direction as developed by marketing or communication leads
Evidence of excellent communication and organizational skills, customer service focused, attention to detail, and high degree of openness to new approaches and new ideas
Ability to interpret input, feedback, and markups
Problem solver who can take initiative and set priorities while being flexible
Ability to work effectively in an environment subject to tight deadlines, which often includes conflicting priorities
Excellent leadership, team building, organizational, and relationship building skills
Ability to effectively select, hire, lead, develop, and evaluate staff
Experience establishing trust, credibility, and respect with internal and external parties
Ability to maintain a high degree of confidentiality and responsibility regarding information related to Enterprise Partners and university business
Relevant qualifications:
Bachelor’s degree in graphic design/visual communications or related field
Eight (8) years of related experience; must include three (3) years of supervisory experience
Demonstrated experience delivering campaigns across different media channels
Preferred education and experience:
Experience in an agency environment or experience working in-house for a large, established brand
Experience working with project management systems, such as Wrike or similar
Benefits:
Hybrid work schedule. We work from home two days a week!
Comprehensive benefits package, including medical, dental, and vision insurance
401(k) plan with matching employer contribution
22 days of vacation time
11 holidays, including your birthday
Parental leave
Significant tuition reductions
Professional development is highly valued at ASU Enterprise Partners, where employees are encouraged to look across the organization and nurture new areas of interest
$30 bi-weekly cell phone reimbursement

At ASU Enterprise Partners:
We serve.
We serve the faculty and staff of ASU to bring them resources so they can do all the great things that they do.
We innovate.
We’re always looking for new ideas, new solutions, new approaches and new ways to address the challenges facing ASU.
We engage.
We engage our donors, philanthropists, investors and partners, connecting them to ASU and helping them share their time, talent and treasure.
We care.
When we serve, innovate and engage, it shows that we care — about faculty, staff, donors, fellow employees and other partners as we bring resources to ASU.

ASU Enterprise Partners and its subsidiaries is an equal opportunity employer that is firmly committed to promoting justice, equity, diversity, and inclusion within our organization and throughout our sphere of influence. Because we embrace a spirit of innovation and achievement, we will endeavor to maximize the talent and potential of all employees, directors, and volunteers through bold and strategic action aimed at building success and a sense of belonging. All employees are expected to act in good faith to support these actions and to not impede the efforts of others to build a just, equitable, diverse, and inclusive organization.
ASU Enterprise Partners is an Equal Opportunity Employer",unavailable,Full-time,"Full-time, ","Benefits
Pulled from the full job description
401(k) matching
Cell phone reimbursement
Dental insurance
Health insurance
Parental leave
Vision insurance
Work from home
&nbsp;",fgdf,hkgh,01/24/2025,false,"3.6
out of 5",29,https://www.indeed.com/rc/clk?jk=60bdafcac05a3033&bb=jnCtIS6FdS9BzfPNvxIIjv600kCG4Q5StayfBAKVvhqizOKvuOLVmlpZfQ1uQbzM-2nh3Ory8Mb9hF-Hoy7O_kB_N0ZOOJ2K5arNIdzzAlsj6StI8nFBjIoN63PIfM4h&xkcb=SoB167M3-QoQBi1r950DbzkdCdPP&fccid=2d77b0a9670ae5b7&vjs=3
2c8c373b-7910-47a9-88c2-47b0c94bd0bc,"Coding Coordinator, Professional Billing Coding",https://www.indeed.com/rc/clk?jk=44a95be7d2716112&bb=jnCtIS6FdS9BzfPNvxIIjoG004E17LdzmQEYxIpfyjnNOOBsSOXzLi6mIEoGnCVO3E7-S3yse4WhCj24aHCkT-hOQxZPMjCC1XRczCVV-R3WISS3giAk4gUWyZZ75Kt8&xkcb=SoDB67M3-QoQBi1r950CbzkdCdPP&fccid=47241ecef828f60c&vjs=3,unavailable,Hennepin Healthcare,https://www.indeed.com/cmp/Hennepin-Healthcare?campaignid=mobvjcmp&from=mobviewjob&tk=1i2gga0vb2i7s00c&fromjk=44a95be7d2716112,393,"Hennepin Healthcare is an integrated system of care that includes HCMC, a nationally recognized Level I Adult Trauma Center and Level I Pediatric Trauma Center and acute care hospital, as well as a clinic system with primary care clinics located in Minneapolis and across Hennepin County. The comprehensive healthcare system includes a 473-bed academic medical center, a large outpatient Clinic & Specialty Center, and a network of clinics in the North Loop, Whittier, and East Lake Street neighborhoods of Minneapolis, and in the suburban communities of Brooklyn Park, Golden Valley, Richfield, and St. Anthony Village. Hennepin Healthcare has a large psychiatric program, home care, and operates a research institute, philanthropic foundation, and Hennepin EMS. The system is operated by Hennepin Healthcare System, Inc., a subsidiary corporation of Hennepin County.

Equal Employment Opportunities: We believe equity is essential for optimal health outcomes and are committed to achieve optimal health for all by actively eliminating barriers due to racism, poverty, gender identity, and other determinants of health. We are committed to equitable care and working in an environment that celebrates, promotes, and protects diversity, equity, inclusion, and belonging. We are committed to bringing in individuals with new cultural perspectives to assist in creating a more equitable healthcare organization.


SUMMARY:
We are currently seeking a Coding Coordinator to join our Professional Billing Coding team. This full-time role will primarily work remote (SHIFT: Days).

Purpose of this position: Supports workflow process/improvements implemented in department. Oversees scheduling of coder training as well as timely submission of professional billing inpatient charges in accordance with regulatory guidelines. Reviews and assigns codes for all diagnoses and procedures according to accepted coding guidelines, regulations, and standards for ICD9-CM and HCMPCS/CPT, as well as those determined by various payers. Maintains productivity standards in place for advanced coders.

Current List of non-MN States where Hennepin Healthcare is an Eligible Employer: Alabama, Arizona, Arkansas, Florida, Georgia, Illinois, Iowa, Nevada, North Carolina, North Dakota, South Carolina, South Dakota, Tennessee, Texas, and Wisconsin.

RESPONSIBILITIES:

Assists coders in determining accurate code selection, communication requests, and educational information (both written and oral) to internal and external customers, to assist the department in meeting their goals
Provides timely and consistent information regarding ICD-10-CM/PCS, HCPCS, and CPT so that the most accurate codes can be assigned for data collection and reimbursement
Serves as a resource for coding questions
Recommends changes to enhance department productivity and effectiveness as well as meet/maintain HHS's quarterly coding accounts receivable goals
Participates in ongoing internal and external audits
Assists in ensuring the automated coding systems, interfaces, and processes are working effectively and efficiently daily. This includes EPIC, Optum, and 3M systems
Reviews new team member training outcomes on a regular and timely basis
Evaluates the medical record documentation for procedures and diagnoses documented in the medical record and accurately assigns ICD-10-CM/PCS, HCPCS, and CPT codes based on National Coding Guidelines
Serves as expert resource for issues relating to coding and abstracting of evaluation and management codes, diseases/procedures, and implications on reimbursement
Serves as a resource in the areas including, but not limited to the following: coding data quality, coding audits, in-service/physician education, and training team
Performs other duties as assigned


QUALIFICATIONS:
Minimum Qualifications:

Associate's degree in business and/or healthcare administration, Health Information Management, or Health Information Technology
Two (2) years coding experience

-OR-

An approved equivalent combination of education and experience

Preferred Qualifications:

Registered Health Information Administrator (RHIA), Registered Health Information Technologist (RHIT), Certified Professional Coder (CPC), or Certified Coding Specialist-Physician (CCS-P)
Experience with Epic electronic medical record functionality and encoder and reimbursement systems recommended
Other approved AHIMA or AAPC credential

Knowledge/ Skills/ Abilities:

Must have extensive and demonstrated expertise in CPT, HCPCS, and ICD-10-CM/PCS coding classification systems
Knowledge of state and federal legislation for HIPAA Privacy, medical record access, and regulatory and accreditation agencies
Knowledge of current medical record technology, statistics, data presentation, and reporting



You've made the right choice in considering Hennepin Healthcare for your employment. We offer a wealth of opportunities for individuals who want to make an impact in our patients' lives. We are dedicated to providing Equal Employment Opportunities to both current and prospective employees. We are driven to connect talented individuals with life-changing career opportunities, enabling you to provide exceptional care without exception. Thank you for considering Hennepin Healthcare as a future employer.

Please Note: Offers of employment from Hennepin Healthcare are conditional and contingent upon successful clearance of all background checks and pre-employment requirements.



Department: Professional Billing Coding
Primary Location: MN-Minneapolis-Downtown Campus
Standard Hours/FTE Status: FTE = 1.00 (80 hours per pay period)
Shift Detail: Day
Job Level: Staff
Employee Status: Regular
Eligible for Benefits: Yes
Union/Non Union: Union
Job Posting: Jun-11-2024",unavailable,Full-time,"Full-time, ",unavailable,fgdf,hkgh,01/23/2025,false,"3.8
out of 5",237,https://www.indeed.com/rc/clk?jk=44a95be7d2716112&bb=jnCtIS6FdS9BzfPNvxIIjoG004E17LdzmQEYxIpfyjnNOOBsSOXzLi6mIEoGnCVO3E7-S3yse4WhCj24aHCkT-hOQxZPMjCC1XRczCVV-R3WISS3giAk4gUWyZZ75Kt8&xkcb=SoDB67M3-QoQBi1r950CbzkdCdPP&fccid=47241ecef828f60c&vjs=3
9ad84e5d-3e87-4614-b655-870053b15eb0,"Risk Adjustment Educator - Denver, CO",https://www.indeed.com/rc/clk?jk=23a547c81c4fbb5f&bb=jnCtIS6FdS9BzfPNvxIIjq7fTFBDCQONqXVJbpmFt_r0ZE1vb6xb941kvqBjqzvdpZjXrkmbsR_Uao-TpaGLloCrvvWuEycBAt4dCdJW9j_XYmv_VCOsrS5phJoMkIUA&xkcb=SoBc67M3-QoQBi1r950BbzkdCdPP&fccid=0150f49158f48413&vjs=3,"Denver, CO",Physician Health Partners,https://www.indeed.com/cmp/Physician-Health-Partners?campaignid=mobvjcmp&from=mobviewjob&tk=1i2gga5ad32m0000&fromjk=23a547c81c4fbb5f,unavailable,"Are you looking to work for a company that has been recognized for over a decade as a Top Place to Work? Apply today to become a part of a company that continues to commit to putting our employees first.
Job Description:
Responsible for educating and advising providers and practice staff in Medicare coding guidelines, focusing on revenue enhancement opportunities. Work in collaboration with other PHP departments and Optum/United HealthCare Medicare Advantage(MA) or other health plans to develop plans and materials that support education and system changes to meet practice and IPA revenue goals.
COMPETENCIES/Role-Specific Functions:
COMMUNICATION
Communicates well both verbally and in writing, creates accurate and punctual reports, delivers presentations, shares information and ideas with others, has good listening skills.
Collaborates to develop plans and present to practices the HCC education program that reflects IPA ethical standards and Medicare guidelines.
Collaborate with Optum and PHP data analysts to develop meaningful practice-level reporting to assist in coding and code submission more effectively.
Work with contracted Medicare Advantage plans, Optum and other third party vendors to drive or supplement educational forums and reports.
PROBLEM SOLVING
Breaks down problems into smaller components, understands underlying issues, can simplify and process complex issues, understands the difference between critical details and unimportant facts.
Identify potential data flow obstacles within assigned practices and work with practice staff to develop action plans to assist practices in overcoming obstacles. Involve PHP Practice Transformation Coach to assist practices as needed.
Identify and solve issues with other vendors (billing companies, clearinghouse, etc.) to remove obstacles that prevent maximum code extraction and submission.
PRODUCTIVITY
Manages a fair workload, volunteers for additional work, prioritizes tasks, develops good work procedures, manages time well, handles information flow.
Risk adjustment chart reviews.
Educate physicians and office staff on coding techniques to accurately document and capture patient acuity to the highest degree of specificity while maintaining Medicare guidelines.
SELF DEVELOPMENT
Seeks out and accepts feedback, is a proactive learner, takes on tough assignments to improve skills, keeps knowledge and skills up-to-date, turns mistakes into learning opportunities.
Maintains working knowledge of changing health industry environment related to the risk adjustment model and CMS expectations such as tolerance, fraud/abuse responses, etc.
Remain current on CEUs to maintain CPC and other professional certifications.
CUSTOMER FOCUS
Builds customer confidence, is committed to increasing customer satisfaction, sets achievable customer expectations, assumes responsibility for solving customer problems, ensures commitments to customers are met, solicits opinions and ideas from customers, responds to customers.
Be a primary resource for physicians and office staff to answer questions or access resources to support documentation and coding for risk adjustment.
Interface with assigned practices on a regular basis to help develop and maintain engagement levels of practices.
Build relationships with practices to help them understand the importance of documentation and coding in a manner that addresses overall patient care management and IPA revenue goals.
JOB KNOWLEDGE
Understands duties and responsibilities, has necessary job knowledge, has necessary technical skills, understands company mission/values, keeps job knowledge current, is in command of critical issues.
Other duties as assigned.
Qualifications (Education/Experience/Knowledge/Skills/Abilities):
Bachelors’ degree in health related field required. Four years of related work experience may be considered in lieu of a degree.
Certified Professional Coder (CPC) required.
Certified Risk Adjustment Coder (CRC) required or commitment to get within 1 year of employment.
Three to five years’ experience with medical records and/or medical coding, preferably risk adjustment coding.
Knowledge of health care insurance claims practice and compliance.
Knowledge of Medicare rules and guidelines.
Knowledge of Claims Coding (CPT, HCPCs, ICD-10, HCFA 1500).
Knowledge of risk adjustment categories and hierarchy preferred.
Knowledge of MS Office Suite, Electronic Medical Records, Encoder, Coding Clinic, other software programs and internet based applications as needed to fulfill position duties.
Skilled in synthesizing data and questions to communicate a cohesive educational training program.
Skilled in responding to practice inquiries in a timely and accurate manner.
Skilled in working collaboratively with various parties to communicate an accurate and meaningful reporting package for practices.
Able to work effectively with physicians, practice staff, health plan/other external parties and PHP multidisciplinary team to streamline efforts to meet HCC Coding goals.
Able to work with sensitive data and relay potential issues or concerns in a diplomatic manner.
Able to multi-task and meet deadlines.
Able to work with external parties to obtain resources as needed.
Able to communicate findings in a clear, concise manner, both internally and externally, including presentations.
Required Licensure or Certification for this position must be maintained by the employee as defined by the company policies and procedures.
A valid unrestricted Colorado drivers’ license.
Reliable and insured vehicle.
Home office that is HIPAA compliant for all remote or telecommuting positions as outlined by the company policies and procedures.
Mobile Device for work purposes as defined by the company policies and procedures.
Physical Demands The physical demands described here are representative of those that must be met by an employee to successfully perform the essential functions of this job. Reasonable accommodations may be made to enable individuals with disabilities to perform the essential functions. While performing the duties of this Job, the employee is regularly required to sit; use hands to finger, handle, or feel and talk or hear. The employee is frequently required to stand; walk; reach with hands and arms and stoop, kneel, crouch, or crawl. The employee is occasionally required to climb or balance. The employee must regularly lift and/or move up to 25 pounds. Specific vision abilities required by this job include close vision and ability to adjust focus.
Work Environment The work environment characteristics described here are representative of those an employee encounters while performing the essential functions of this job. Reasonable accommodations may be made to enable individuals with disabilities to perform the essential functions. The noise level in the work environment is usually moderate.
Salary Range:
$58,510- 73,137",- Full-time,"$58,510 - $73,137 a year",unavailable,unavailable,fgdf,hkgh,01/18/2025,false,"3.6
out of 5",unavailable,https://www.indeed.com/rc/clk?jk=23a547c81c4fbb5f&bb=jnCtIS6FdS9BzfPNvxIIjq7fTFBDCQONqXVJbpmFt_r0ZE1vb6xb941kvqBjqzvdpZjXrkmbsR_Uao-TpaGLloCrvvWuEycBAt4dCdJW9j_XYmv_VCOsrS5phJoMkIUA&xkcb=SoBc67M3-QoQBi1r950BbzkdCdPP&fccid=0150f49158f48413&vjs=3
