jobId,title,job_url,branch,company,company_url,review,description,type,salary,shift,benefit,category,subcategory,expire_at,is_claimed,average_rating,number_of_jobs,third_party_apply_url
4ab82464-7e05-459e-bf44-a3b65b94e1c3,Pro Fee Coding Specialist (full-time),https://www.indeed.com/rc/clk?jk=0e67043b7b8dbe06&bb=jnCtIS6FdS9BzfPNvxIIjpTPRId7aZ7swr7-rcKCbs4YE3-hcihc5xEK9bfRmv7OUa-j0Bh_O7AAF2ti7g0ld4ZwKUV-cfrQcpu-D1M-S9sTjKYMmzGeJGtCvgw8BUbh&xkcb=SoAB67M3-QoQBi1r950PbzkdCdPP&fccid=b592ec6b1e4771b6&vjs=3,unavailable,Saint Francis Health System,https://www.indeed.com/cmp/Saint-Francis-Health-System?campaignid=mobvjcmp&from=mobviewjob&tk=1i2gg99qqnj9q802&fromjk=0e67043b7b8dbe06,522,"Full Time
This position may be eligible for a $2,500 sign-on bonus based on candidate eligibility.
Hours: The scheduling for this position is flexible but employees must work at least 40 hours per week. Weekends and evenings may qualify for additional shift differentials.
Job Summary: The Pro Fee Coding Specialist performs diagnosis and/or procedural coding as assigned in order to apply the appropriate diagnosis and procedural codes to individual patient health information for data retrieval, analysis, and claims processing.

Minimum Education: Commensurate education with achieving qualifications to sit for Certification Exam(s) as related to ICD-10, CPT and other related specialty certifications.

Licensure, Registration and/or Certification: Certified Coder through AAPC, AHIMA, BCHH-C, HCCS for Home Health or National Healthcare Association. Applicants who have not yet achieved a coding certification may be considered when work experience is at least two years. The applicant will need to obtain the certification within one year of hire.

Work Experience: 0 - 2 years related experience including a demonstrated thorough understanding of the content of the medical record in order to be able to locate information to support or provide specificity for coding. Requires experience and/or training in the anatomy and physiology of the human body and disease processes in order to understand the etiology, pathology, symptoms, signs, diagnostic studies, treatment modalities, and prognosis of diseases and procedures to be coded.

Knowledge, Skills and Abilities: Basic computer and encoder skills. Effective interpersonal, oral and written communication skills. Ability to organize and prioritize work in an efficient and effective manner. Uses good judgment when determining whether a record is complete enough to code or should be held for more documentation. Ability and requires maintaining continuing education credits for credentialed coders, stays updated on coding rules, attends seminars and reviews and coding periodicals. Ability to be cooperative, dependable and responsive to the changing nature of the coding workflow. Ability to be flexible when asked to do different assignments.

Essential Functions and Responsibilities: Codes as assigned from review of medical record documentation. Applies knowledge of current coding and billing requirements to assure claims are submitted correctly. Monitors coding and billing performance and resolves denials related to coding errors. Performs review for charge corrections and rebilling as required for resolution of coding denials. Develops preventative measures in response to patterns identified through analysis of claims denial data; prepares periodic reports for clinical staff, identifying corrective measures to resolve denial problems. Advises and instructs providers regarding documentation and billing policies, procedures and regulations; interacts with providers regarding conflicting, ambiguous or none-specific documentation, obtaining clarification of same. Educates provides and office staff regarding documentation coding and billing changes and regulations to assure compliance with local, state and national policies. Works collaboratively with providers, office staff, billing personnel, quality department and compliance, and coding resources to ensure accurate coding.

Decision Making: Independent judgment in planning sequence of operations and making minor decisions in a complex technical or professional field.

Working Relationships: Works with internal customers via telephone or face to face interaction. Works with other healthcare professionals and staff.

Special Job Dimensions: None.
Supplemental Information: This document generally describes the essential functions of the job and the physical demands required to perform the job. This compilation of essential functions and physical demands is not all inclusive nor does it prohibit the assignment of additional duties.
#GENIND
Health Information Ambulatory Coding - Yale Campus
Location:
Tulsa, Oklahoma 74136
EOE Protected Veterans/Disability",unavailable,Full-time,"Full-time, ",unavailable,fgdf,hkgh,10/24/2024,false,"3.7
out of 5",439,https://www.indeed.com/rc/clk?jk=0e67043b7b8dbe06&bb=jnCtIS6FdS9BzfPNvxIIjpTPRId7aZ7swr7-rcKCbs4YE3-hcihc5xEK9bfRmv7OUa-j0Bh_O7AAF2ti7g0ld4ZwKUV-cfrQcpu-D1M-S9sTjKYMmzGeJGtCvgw8BUbh&xkcb=SoAB67M3-QoQBi1r950PbzkdCdPP&fccid=b592ec6b1e4771b6&vjs=3
5e8c6f09-0428-4a42-8623-d42edee03d48,Mechatronics Technician Weekend Shift (InSinkErator),https://www.indeed.com/rc/clk?jk=4eec72b2b1daa427&bb=jnCtIS6FdS9BzfPNvxIIjvSVRw95JTPpFN6Hbc3VbsisW6HnlQI1drpr8QwDq5kX4Uf7ij2fF-N3o57oa6iEYRNspLUJcNGyx_tJvOrAhJlyeubOjF_O9w%3D%3D&xkcb=SoC167M3-QoQBi1r950ObzkdCdPP&fccid=c403821dbe674a88&vjs=3,"Racine, WI",Whirlpool,https://www.indeed.com/cmp/Whirlpool-Corporation?campaignid=mobvjcmp&from=mobviewjob&tk=1i2gg9fe6n5b280h&fromjk=4eec72b2b1daa427,5.1K,"Requisition ID: 62719

ABOUT WHIRLPOOL CORPORATION
Whirlpool Corporation (NYSE: WHR) is committed to being the best global kitchen and laundry company, in constant pursuit of improving life at home. In an increasingly digital world, the company is driving purposeful innovation to meet the evolving needs of consumers through its iconic brand portfolio, including Whirlpool, KitchenAid, Maytag, Consul, Brastemp, Amana, Bauknecht, JennAir, Indesit and InSinkErator. In 2023, the company reported approximately $19 billion in annual sales, 59,000 employees and 55 manufacturing and technology research centers. Additional information about the company can be found at WhirlpoolCorp.com.

This role in summary

This position provides direct day-to-day support for controls, logic,
processes, programming, system integration, troubleshooting, and ensuring operations
equipment conforms to network, communications, and programming/software standards.
Requires supporting Engineering Controls in the development, installation, and start-up
of new production equipment and technology.

Your responsibilities will include
Work independently with minimum supervision required. Interface with
stakeholders from all levels of the organization, including external
vendors/contractors

Provide day-to-day technical guidance and expertise (lead, coordinate and
facilitate troubleshooting) in the modification of hardware, software, electrical and
power transmission control systems to improve safety, reliability, and operational
readiness of manufacturing equipment

Diagnose and repair electrical and mechanical issues. Issues may include the
testing, replacement or repair of electrical systems including single phase or
three phase electrical systems up to 480 volts, AC or DC motors, power supplies,
frequency drives, servo drives, transformers, motor starters, proximity sensors,
encoders, photo eyes, programmable logic Controllers (PLC), HMI’s, PLC
Inputs/Outputs

Support Engineering Controls in training development, process standardization,
and quality documentation adherence as requested for new and updated
systems

Support set-up and troubleshooting of motion control systems including servos
and robotic systems

Perform and troubleshoot complex applications and equipment involving
electrical/electronic circuits and equipment that interfaces with PC/VM based
applications, PAC controllers and a variety of operator interfaces

Analyze data on information for analysis, RCA, FMEA
Analyze Real-Time equipment operating data (Digital Dashboard) to aid in
making informed troubleshooting process related decisions

Increase skills and knowledge by attending technical training sessions,
participating in vendor visits, and scheduled maintenance activities

Complete NFPA 70E Training and maintain certification
Minimum requirements
Associates degree in Automated Manufacturing Systems Technology or a related
field (Preferably Electronics) and 5 years of relevant experience; or High School
diploma or equivalent and 10 years of relevant experience

Demonstrated understanding of advanced machine repair, maintenance techniques,
practices, and standard mechanical functions with a NOCTI evaluation of 70 or
higher

Advanced level of software/hardware skills (troubleshooting, MS, SQL, CAD, Iconics,
Ignition, PLC programming)

Strong electro-mechanical skills and problem-solving practices using root-cause
analysis

Ability to read electrical schematic, wiring diagrams, and PLC ladder and block logic
Ability to load programs or configure PLC’s, HMI, scanners
Fully competent in Keyence/Cognex/Fanuc or other vision systems
Comprehension of Industrial Network Communication
Visual Basic (and/or.Net) knowledge in Manufacturing production
Knowledge of RFID in manufacturing production
Proficient use of electrical/electronic, computer, and test equipment
Proficient in MS Office- Word, Excel, and PowerPoint
Preferred skills and experiences
Ability to effectively present information and respond to questions from management
teams

Ability to read, analyze and interpret technical procedures. Ability to write reports,
business correspondence, and manuals

Ability to set-up and operate automated manufacturing systems and associated
equipment

Ability to make accurate arithmetic calculations, read/analyze blueprints, schematics
guidelines, and/or diagrams to ensure product specifications and tolerance levels are
met

Ability to analyze yield results and adjust machines to control defects
Operate standard and powered hand tools, precision measuring devices and
gauges, material handling equipment, and personal computer

Complete understanding of safe work practices and policies and ability to work safely
without presenting a direct threat to self or others and compliance with all safety and
OSHA regulations

Connect with us and learn more about Whirlpool Corporation

See what it's like to work at Whirlpool by visiting Whirlpool Careers. Additional information about the company can be found on Facebook, Twitter, LinkedIn, Instagram and YouTube.

At Whirlpool Corporation, we value and celebrate diversity. Whirlpool Corporation is committed to equal employment opportunity and prohibits any discrimination on the basis of race or ethnicity, religion, sex, pregnancy, gender expression or identity, sexual orientation, age, physical or mental disability, veteran status, or any other category protected by applicable law.",unavailable,unavailable,"Weekends as needed, ",unavailable,fgdf,hkgh,01/29/2025,false,"3.8
out of 5",100,https://www.indeed.com/rc/clk?jk=4eec72b2b1daa427&bb=jnCtIS6FdS9BzfPNvxIIjvSVRw95JTPpFN6Hbc3VbsisW6HnlQI1drpr8QwDq5kX4Uf7ij2fF-N3o57oa6iEYRNspLUJcNGyx_tJvOrAhJlyeubOjF_O9w%3D%3D&xkcb=SoC167M3-QoQBi1r950ObzkdCdPP&fccid=c403821dbe674a88&vjs=3
9b32a40e-25ef-49d6-bdd5-3b6e26bb49b7,"Mgr, Hospital Coding - Contract Coding and Analytics",https://www.indeed.com/rc/clk?jk=3ca9db9d8aee73e9&bb=jnCtIS6FdS9BzfPNvxIIjlGG1JR91WUn0dxpcl32lu4fKJkgeBZWhJqXC8ZAAR82npm2CnvAyeI-7kZ_1ckvPhHI7y-XPKxHNMb0aDqd_cGw-5TWaITNag%3D%3D&xkcb=SoAo67M3-QoQBi1r950NbzkdCdPP&fccid=833ef092852b29f4&vjs=3,"Warrenville, IL 60555",Edward-Elmhurst Health,https://www.indeed.com/cmp/Endeavor-Health-1?campaignid=mobvjcmp&from=mobviewjob&tk=1i2gg9lif32ma000&fromjk=3ca9db9d8aee73e9,1.6K,"Position Highlights:
Position: Manager, Contract Coding and Analytics
Location: Winnfield, IL
Full Time
Hours: Monday-Friday, standard business hours

A Brief Overview:
This position is responsible to ensure coding and abstraction of data for all inpatient, hospital outpatient and some physician billing service line charges and/or technical component for medical group billing while meeting the corporate goals established (i.e. Candidate for Bill and HIM Discharge Not Billed) as well as abstracting core measure patients timely and accurately. To manage training of new staff, interns or current staff regarding Epic upgrades, changes to coding rules or new quality measures. Collaborate with CDI and professional/medical group coding team to maximize code capture and establish working relationship to identify areas of opportunity to improve or maintain coding compliance, CMI and single-path coding. Manage facility outpatient coders for single path coding/concurrent coding service lines to follow Professional Billing rules.

What you will do:
Promotes teamwork philosophy and pursues excellence in customer service within area managed.
Ensures the proper education of staff relating to coding, abstracting, reimbursement and billing when applicable.
Interviews and hires personnel for area managed and evaluates direct reporting staff.
Supports and advises supervisors regarding training, evaluation, discipline and recognition of personnel.
Conducts at a minimum quarterly staff meetings (two on site annually) and makes use of all available forms of communication to keep staff informed and solicit input. Ensures minutes of meetings are maintained and distributed to all coders unable to attend.
Evaluate and recommend appropriate staffing needs to meet benchmark goals.
Develops, prepares and aggregates management reports for the timely and accurate analysis of established benchmark goals.
Reviews and approves objective performance standards set and monitored by supervisors.
Promotes employee engagement, culture diversity and inclusion and safety within department.
Review priorities set by supervisors and to meet weekly CFB/ DNB and other benchmark goals.
Approves or obtains approval when needed to meet supervisors identified staffing needs to cover planned or unplanned time off or to meet goals.
Evaluate and propose new technology other resources needed to meet or exceed corporate goals and initiatives.
Ensures optimization of current technology and workflow processes to meet efficiency and optimal productivity.
Ensures supervisors have reviewed results of monthly productivity statistics and quality review results with staff and ensures supervisors have implemented PIP, corrective action or education as needed.
Works with CMC and CDI teams to meet CDI Executive Committee goals for CMI and CC capture rate.
Provides weekly progress report to director and updates corporate communication documents on collaboration portal.
Works with Corporate Compliance to review and appeal RAC or other payor denials due to coding or DRG assignment completing chart reviews timely and submitting any supporting documentation necessary for appeal.
Works directly with IS, Epic and 3M to discuss enhancements, submit requests for enhancements and/or required changes to workflow, reports or system updates. Reviews release notes and determines items to be implemented at go-live or post go-live. Participates in testing system according to IS scripts for go-live.
Customer Issues - Work with Support Services, PBB, Customer Service, SSC and all other areas in the accurate and timely completion of billing issues, code amendments and meeting the needs of NorthShore University HealthSystem customers.
Reviews coding audit results with supervisors and ensures staff are updated as to results and provided any additional education needed based on results.
Review of Denied Claims: Review all denied claims from any and all payers. Track, research and resolve by payor due date.
Tracks key accomplishments for area managed and reports at fiscal year-end.
Supports supervisors in their liaison role and fills in as liaison for Director when needed.
Maintains current job descriptions for each position in area managed.
Works in conjunction with corporate compliance to maintain and update current policies, procedures and internal coding procedures in the Share Drive and follows all applicable federal, state, and local regulations.
Provides frequent and consistent status reports to the Director on the management of the supervised areas.
Assist director in setting performance improvement objectives for department. Works in conjunction with supervisors to monitors and document improvements.
Performs other duties as assigned.

What you will need:
Associates Degree Required or Bachelors Degree Health Administration Preferred
3 Years of hospital coding experience required.and 2 Years of management experience REQUIRED for RHIT candidates.
3 Years of management experience PREFERRED for RHIA candidates
Full understanding of ICD-10-CM and ICD-10 PCS, CPT-4, and HCPCS coding classifications, DRG, RUGS, IRFPPS (Inpatient Rehab Facility Prospective Payment System) and APC payment systems and all applicable rules and regulations.
General understanding of computers and Microsoft Windows. Experience with 3M Encoder/Grouper software system or similar product.
Intermediate to advanced level of Excel. Experience with Visio helpful.
Strong supervisory and communication skills required. Imaginative and detail oriented.
Ability to cope with fast paced, rapidly changing environment.
Ability to deal with a broad range of personalities and skill levels.
Ability to write reports, business correspondence, and policy and procedures.
Must have excellent problem-solving skills, be able to collect data and analyze data to draw valid conclusions.
Must have excellent organizational skills and must be able to prioritize workload and work independently.
Registered Health Information Technician (RHIT) - American Health Information Management Association (AHIMA) Registered Health Information Technician (RHIT) Required Or
Registered Health Information Administrator (RHIA) - American Health Information Management Association (AHIMA) Registered Health Information Administrator (RHIA) Required
Benefits:
Career Pathways to Promote Professional Growth and Development
Various Medical, Dental, and Vision options, including Domestic Partner Coverage
Tuition Reimbursement
Free Parking at designated locations
Wellness Program Savings Plan
Health Savings Account Options
Retirement Options with Company Match
Paid Time Off and Holiday Pay
Community Involvement Opportunities
Endeavor Health is a fully integrated healthcare delivery system committed to providing access to quality, vibrant, community-connected care, serving an area of more than 4.2 million residents across six northeast Illinois counties. Our more than 25,000 team members and more than 6,000 physicians aim to deliver transformative patient experiences and expert care close to home across more than 300 ambulatory locations and eight acute care hospitals – Edward (Naperville), Elmhurst, Evanston, Glenbrook (Glenview), Highland Park, Northwest Community (Arlington Heights) Skokie and Swedish (Chicago) – all recognized as Magnet hospitals for nursing excellence. Located in Naperville, Linden Oaks Behavioral Health, provides for the mental health needs of area residents. For more information, visit
https://www.endeavorhealth.org/careers
.
When you work for Endeavor Health, you will be part of an organization that encourages its employees to achieve career goals and maximize their professional potential.
Please explore our website (
https://www.endeavorhealth.org/careers
) to better understand how
Endeavor Health delivers on its mission to “help everyone in our communities be their best”.
Endeavor Health is committed to working with and providing reasonable accommodation to individuals with disabilities. Please refer to the main career page for more information.
Diversity, equity and inclusion is at the core of who we are; being there for our patients and each other with compassion, respect and empathy. We believe that our strength resides in our differences and in connecting our best to provide community-connected healthcare for all.
EOE: Race/Color/Sex/Sexual Orientation/ Gender Identity/Religion/National Origin/Disability/Vets, VEVRRA Federal Contractor.
#LI-JR2",unavailable,Full-time,"Full-time, ","Benefits
Pulled from the full job description
Dental insurance
Free parking
Health insurance
Health savings account
Paid time off
Partner benefits
Retirement plan
Show more
&nbsp;",fgdf,hkgh,10/24/2024,false,"3.7
out of 5",1.8K,https://www.indeed.com/rc/clk?jk=3ca9db9d8aee73e9&bb=jnCtIS6FdS9BzfPNvxIIjlGG1JR91WUn0dxpcl32lu4fKJkgeBZWhJqXC8ZAAR82npm2CnvAyeI-7kZ_1ckvPhHI7y-XPKxHNMb0aDqd_cGw-5TWaITNag%3D%3D&xkcb=SoAo67M3-QoQBi1r950NbzkdCdPP&fccid=833ef092852b29f4&vjs=3
fb7e87ad-a5cd-4697-bdb8-4ca00409b9b7,Coding Auditor,https://www.indeed.com/rc/clk?jk=771c51ee55d34c24&bb=jnCtIS6FdS9BzfPNvxIIjuQmP3HCc8kO_jjGcMt-u_OcIwZotE-8LkOndj-ZXrCrN_zRSsDAQyY-HKZRsIIRgDhqWwhPEseDWkJVcfXUkgPnu1MlBPcF8r4lnQCMe36k&xkcb=SoCc67M3-QoQBi1r950MbzkdCdPP&fccid=dd616958bd9ddc12&vjs=3,"Houma, LA 70360",unavailable,unavailable,unavailable,"Job Duties:

Develop and maintain physician audit plan to include a yearly review of:
a. Clinic and hospital EM services
b. Medical necessity issues with Denials and encounters no-billed
Perform coding and billing audits and provide written audit reports to administration and the providers.


Perform data analysis to ensure coding compliance of providers, including level of service analysis against Medicare and other pertinent benchmarks, i.e. MedAxiom and White Plume reports.


Develop and present educational materials, based on audit findings, to providers, management, coding and billing staff on correct coding guidelines and government policies per state regulations.


Develop policy guidelines and procedures in accordance with governmental regulations and the medical industry standards/practices. Research, develop and maintain documentation on coding guidelines for physician practices.
Maintain thorough knowledge of CMS/Medicare/Medicaid & private payer, NCDs, LA MC LCDs, documentation and coding rules for cardiology.
Prepare communications for practice administrators and others on identified issues and pertinent changes.
Act as liaison between business services and clinics on coding issues.

Job Requirements:

Bachelor of Science Degree or LPN and Certification as a Professional Coder.
Minimum of five (5) years experience.
Physician E/M coding and auditing experience preferred
Strong project management and presentation skills preferred.
Experience with Optum encoder, EMR and billing software preferred.

Standards of Performance:

1. Keeps work area neat and organized. Reports safety issues to team leader immediately.

2. Works efficiently and manages time wisely. Assist other employees when all duties are complete.

3. Communicates any problems, difficulties or concerns regarding job duties to the team leader.

4. Performs all duties without significant error occurring with any regularity.

5. Meets all deadlines and timeframes for completion of assignments.

6. Represents CIS in a professional manner at all times. Demonstrates acceptable ability to interact with physicians, staff (“internal customers”) and “external customers” (patients, family members, insurance companies, home health etc.) on a professional level at all times. Exhibits good communication skills with physicians, patients, team leaders, and co-workers at all times.

7. Exhibits whenever possible a harmonious relationship with other employees in order to accomplish the duties and responsibilities of the position. While perfect harmonious relationships with all employees are sometimes not achievable, not more than an occasional complaint should be received by the team leader about the incumbent of this position.

8. The employee shall work and relate cooperatively with all other employees (internal customers) to assure optimum care for the patients and to achieve standards of care set forth by the medical staff.

9. Adheres to the Compliance Plan as it pertains to the above specific job duties. Uses best efforts to maintain compliance by following the Corporate Compliance Plan, attending compliance education, following medical documentation guidelines, and communicating concerns regarding compliance issues.

10. Performs accurate and complete documentation in the patient’s medical record, when applicable.

11. Work with the electronic medical record (EMR) staff to maintain quality and work towards future EMR development.

12. Maintains patient confidentiality according to the HIPAA standards of privacy and security.",unavailable,Full-time,"Full-time, ",unavailable,fgdf,hkgh,12/13/2024,false,unavailable,unavailable,https://www.indeed.com/rc/clk?jk=771c51ee55d34c24&bb=jnCtIS6FdS9BzfPNvxIIjuQmP3HCc8kO_jjGcMt-u_OcIwZotE-8LkOndj-ZXrCrN_zRSsDAQyY-HKZRsIIRgDhqWwhPEseDWkJVcfXUkgPnu1MlBPcF8r4lnQCMe36k&xkcb=SoCc67M3-QoQBi1r950MbzkdCdPP&fccid=dd616958bd9ddc12&vjs=3
