jobId,title,job_url,branch,company,company_url,review,description,type,salary,shift,benefit,category,subcategory,expire_at,is_claimed,average_rating,number_of_jobs,third_party_apply_url
63da1702-533e-4785-9d4f-0dd2a266e1cb,"Mgr, Hospital Coding - Contract Coding and Analytics",https://www.indeed.com/rc/clk?jk=3ca9db9d8aee73e9&bb=dOl6zOEJ2hyMLdPFEMtoRqr1ZrPZd942T1FUUZgyGYC50MhfyA1Qlp2ut5eoi9PjxcmVugQ35c6fm-79e49lm78adcHw0Rrhd9XA8jtXB5UbmJdBR-darg%3D%3D&xkcb=SoDk67M3-QXVFsysTp1YbzkdCdPP&fccid=833ef092852b29f4&vjs=3,"Warrenville, IL 60555",Edward-Elmhurst Health,https://www.indeed.com/cmp/Endeavor-Health-1?campaignid=mobvjcmp&from=mobviewjob&tk=1i2gfph7p2p74000&fromjk=3ca9db9d8aee73e9,1.6K,"Position Highlights:
Position: Manager, Contract Coding and Analytics
Location: Winnfield, IL
Full Time
Hours: Monday-Friday, standard business hours

A Brief Overview:
This position is responsible to ensure coding and abstraction of data for all inpatient, hospital outpatient and some physician billing service line charges and/or technical component for medical group billing while meeting the corporate goals established (i.e. Candidate for Bill and HIM Discharge Not Billed) as well as abstracting core measure patients timely and accurately. To manage training of new staff, interns or current staff regarding Epic upgrades, changes to coding rules or new quality measures. Collaborate with CDI and professional/medical group coding team to maximize code capture and establish working relationship to identify areas of opportunity to improve or maintain coding compliance, CMI and single-path coding. Manage facility outpatient coders for single path coding/concurrent coding service lines to follow Professional Billing rules.

What you will do:
Promotes teamwork philosophy and pursues excellence in customer service within area managed.
Ensures the proper education of staff relating to coding, abstracting, reimbursement and billing when applicable.
Interviews and hires personnel for area managed and evaluates direct reporting staff.
Supports and advises supervisors regarding training, evaluation, discipline and recognition of personnel.
Conducts at a minimum quarterly staff meetings (two on site annually) and makes use of all available forms of communication to keep staff informed and solicit input. Ensures minutes of meetings are maintained and distributed to all coders unable to attend.
Evaluate and recommend appropriate staffing needs to meet benchmark goals.
Develops, prepares and aggregates management reports for the timely and accurate analysis of established benchmark goals.
Reviews and approves objective performance standards set and monitored by supervisors.
Promotes employee engagement, culture diversity and inclusion and safety within department.
Review priorities set by supervisors and to meet weekly CFB/ DNB and other benchmark goals.
Approves or obtains approval when needed to meet supervisors identified staffing needs to cover planned or unplanned time off or to meet goals.
Evaluate and propose new technology other resources needed to meet or exceed corporate goals and initiatives.
Ensures optimization of current technology and workflow processes to meet efficiency and optimal productivity.
Ensures supervisors have reviewed results of monthly productivity statistics and quality review results with staff and ensures supervisors have implemented PIP, corrective action or education as needed.
Works with CMC and CDI teams to meet CDI Executive Committee goals for CMI and CC capture rate.
Provides weekly progress report to director and updates corporate communication documents on collaboration portal.
Works with Corporate Compliance to review and appeal RAC or other payor denials due to coding or DRG assignment completing chart reviews timely and submitting any supporting documentation necessary for appeal.
Works directly with IS, Epic and 3M to discuss enhancements, submit requests for enhancements and/or required changes to workflow, reports or system updates. Reviews release notes and determines items to be implemented at go-live or post go-live. Participates in testing system according to IS scripts for go-live.
Customer Issues - Work with Support Services, PBB, Customer Service, SSC and all other areas in the accurate and timely completion of billing issues, code amendments and meeting the needs of NorthShore University HealthSystem customers.
Reviews coding audit results with supervisors and ensures staff are updated as to results and provided any additional education needed based on results.
Review of Denied Claims: Review all denied claims from any and all payers. Track, research and resolve by payor due date.
Tracks key accomplishments for area managed and reports at fiscal year-end.
Supports supervisors in their liaison role and fills in as liaison for Director when needed.
Maintains current job descriptions for each position in area managed.
Works in conjunction with corporate compliance to maintain and update current policies, procedures and internal coding procedures in the Share Drive and follows all applicable federal, state, and local regulations.
Provides frequent and consistent status reports to the Director on the management of the supervised areas.
Assist director in setting performance improvement objectives for department. Works in conjunction with supervisors to monitors and document improvements.
Performs other duties as assigned.

What you will need:
Associates Degree Required or Bachelors Degree Health Administration Preferred
3 Years of hospital coding experience required.and 2 Years of management experience REQUIRED for RHIT candidates.
3 Years of management experience PREFERRED for RHIA candidates
Full understanding of ICD-10-CM and ICD-10 PCS, CPT-4, and HCPCS coding classifications, DRG, RUGS, IRFPPS (Inpatient Rehab Facility Prospective Payment System) and APC payment systems and all applicable rules and regulations.
General understanding of computers and Microsoft Windows. Experience with 3M Encoder/Grouper software system or similar product.
Intermediate to advanced level of Excel. Experience with Visio helpful.
Strong supervisory and communication skills required. Imaginative and detail oriented.
Ability to cope with fast paced, rapidly changing environment.
Ability to deal with a broad range of personalities and skill levels.
Ability to write reports, business correspondence, and policy and procedures.
Must have excellent problem-solving skills, be able to collect data and analyze data to draw valid conclusions.
Must have excellent organizational skills and must be able to prioritize workload and work independently.
Registered Health Information Technician (RHIT) - American Health Information Management Association (AHIMA) Registered Health Information Technician (RHIT) Required Or
Registered Health Information Administrator (RHIA) - American Health Information Management Association (AHIMA) Registered Health Information Administrator (RHIA) Required
Benefits:
Career Pathways to Promote Professional Growth and Development
Various Medical, Dental, and Vision options, including Domestic Partner Coverage
Tuition Reimbursement
Free Parking at designated locations
Wellness Program Savings Plan
Health Savings Account Options
Retirement Options with Company Match
Paid Time Off and Holiday Pay
Community Involvement Opportunities
Endeavor Health is a fully integrated healthcare delivery system committed to providing access to quality, vibrant, community-connected care, serving an area of more than 4.2 million residents across six northeast Illinois counties. Our more than 25,000 team members and more than 6,000 physicians aim to deliver transformative patient experiences and expert care close to home across more than 300 ambulatory locations and eight acute care hospitals – Edward (Naperville), Elmhurst, Evanston, Glenbrook (Glenview), Highland Park, Northwest Community (Arlington Heights) Skokie and Swedish (Chicago) – all recognized as Magnet hospitals for nursing excellence. Located in Naperville, Linden Oaks Behavioral Health, provides for the mental health needs of area residents. For more information, visit
https://www.endeavorhealth.org/careers
.
When you work for Endeavor Health, you will be part of an organization that encourages its employees to achieve career goals and maximize their professional potential.
Please explore our website (
https://www.endeavorhealth.org/careers
) to better understand how
Endeavor Health delivers on its mission to “help everyone in our communities be their best”.
Endeavor Health is committed to working with and providing reasonable accommodation to individuals with disabilities. Please refer to the main career page for more information.
Diversity, equity and inclusion is at the core of who we are; being there for our patients and each other with compassion, respect and empathy. We believe that our strength resides in our differences and in connecting our best to provide community-connected healthcare for all.
EOE: Race/Color/Sex/Sexual Orientation/ Gender Identity/Religion/National Origin/Disability/Vets, VEVRRA Federal Contractor.
#LI-JR2",unavailable,Full-time,unavailable,"Benefits
Pulled from the full job description
Dental insurance
Free parking
Health insurance
Health savings account
Paid time off
Partner benefits
Retirement plan
Show more
&nbsp;",test ,test3,02/23/2025,false,unavailable,1.8K,https://www.indeed.com/rc/clk?jk=3ca9db9d8aee73e9&bb=dOl6zOEJ2hyMLdPFEMtoRqr1ZrPZd942T1FUUZgyGYC50MhfyA1Qlp2ut5eoi9PjxcmVugQ35c6fm-79e49lm78adcHw0Rrhd9XA8jtXB5UbmJdBR-darg%3D%3D&xkcb=SoDk67M3-QXVFsysTp1YbzkdCdPP&fccid=833ef092852b29f4&vjs=3
6efb7a3f-48c7-44da-bcf4-37c36f1924f6,Mechatronics Technician Weekend Shift (InSinkErator),https://www.indeed.com/rc/clk?jk=4eec72b2b1daa427&bb=dOl6zOEJ2hyMLdPFEMtoRv0brnwQyHicf7WceNga7EtWoxE3lFZwHhwbJyeiDSdPNL58m90Xej-ENZeKgSyv-3M7Dp3cd6cI20XOeQbLoTQBYIThJ6Gu-Q%3D%3D&xkcb=SoD367M3-QXVFsysTp1cbzkdCdPP&fccid=c403821dbe674a88&vjs=3,"Racine, WI",Whirlpool,https://www.indeed.com/cmp/Whirlpool-Corporation?campaignid=mobvjcmp&from=mobviewjob&tk=1i2gfq15cku5086b&fromjk=4eec72b2b1daa427,5.1K,"Requisition ID: 62719

ABOUT WHIRLPOOL CORPORATION
Whirlpool Corporation (NYSE: WHR) is committed to being the best global kitchen and laundry company, in constant pursuit of improving life at home. In an increasingly digital world, the company is driving purposeful innovation to meet the evolving needs of consumers through its iconic brand portfolio, including Whirlpool, KitchenAid, Maytag, Consul, Brastemp, Amana, Bauknecht, JennAir, Indesit and InSinkErator. In 2023, the company reported approximately $19 billion in annual sales, 59,000 employees and 55 manufacturing and technology research centers. Additional information about the company can be found at WhirlpoolCorp.com.

This role in summary

This position provides direct day-to-day support for controls, logic,
processes, programming, system integration, troubleshooting, and ensuring operations
equipment conforms to network, communications, and programming/software standards.
Requires supporting Engineering Controls in the development, installation, and start-up
of new production equipment and technology.

Your responsibilities will include
Work independently with minimum supervision required. Interface with
stakeholders from all levels of the organization, including external
vendors/contractors

Provide day-to-day technical guidance and expertise (lead, coordinate and
facilitate troubleshooting) in the modification of hardware, software, electrical and
power transmission control systems to improve safety, reliability, and operational
readiness of manufacturing equipment

Diagnose and repair electrical and mechanical issues. Issues may include the
testing, replacement or repair of electrical systems including single phase or
three phase electrical systems up to 480 volts, AC or DC motors, power supplies,
frequency drives, servo drives, transformers, motor starters, proximity sensors,
encoders, photo eyes, programmable logic Controllers (PLC), HMI’s, PLC
Inputs/Outputs

Support Engineering Controls in training development, process standardization,
and quality documentation adherence as requested for new and updated
systems

Support set-up and troubleshooting of motion control systems including servos
and robotic systems

Perform and troubleshoot complex applications and equipment involving
electrical/electronic circuits and equipment that interfaces with PC/VM based
applications, PAC controllers and a variety of operator interfaces

Analyze data on information for analysis, RCA, FMEA
Analyze Real-Time equipment operating data (Digital Dashboard) to aid in
making informed troubleshooting process related decisions

Increase skills and knowledge by attending technical training sessions,
participating in vendor visits, and scheduled maintenance activities

Complete NFPA 70E Training and maintain certification
Minimum requirements
Associates degree in Automated Manufacturing Systems Technology or a related
field (Preferably Electronics) and 5 years of relevant experience; or High School
diploma or equivalent and 10 years of relevant experience

Demonstrated understanding of advanced machine repair, maintenance techniques,
practices, and standard mechanical functions with a NOCTI evaluation of 70 or
higher

Advanced level of software/hardware skills (troubleshooting, MS, SQL, CAD, Iconics,
Ignition, PLC programming)

Strong electro-mechanical skills and problem-solving practices using root-cause
analysis

Ability to read electrical schematic, wiring diagrams, and PLC ladder and block logic
Ability to load programs or configure PLC’s, HMI, scanners
Fully competent in Keyence/Cognex/Fanuc or other vision systems
Comprehension of Industrial Network Communication
Visual Basic (and/or.Net) knowledge in Manufacturing production
Knowledge of RFID in manufacturing production
Proficient use of electrical/electronic, computer, and test equipment
Proficient in MS Office- Word, Excel, and PowerPoint
Preferred skills and experiences
Ability to effectively present information and respond to questions from management
teams

Ability to read, analyze and interpret technical procedures. Ability to write reports,
business correspondence, and manuals

Ability to set-up and operate automated manufacturing systems and associated
equipment

Ability to make accurate arithmetic calculations, read/analyze blueprints, schematics
guidelines, and/or diagrams to ensure product specifications and tolerance levels are
met

Ability to analyze yield results and adjust machines to control defects
Operate standard and powered hand tools, precision measuring devices and
gauges, material handling equipment, and personal computer

Complete understanding of safe work practices and policies and ability to work safely
without presenting a direct threat to self or others and compliance with all safety and
OSHA regulations

Connect with us and learn more about Whirlpool Corporation

See what it's like to work at Whirlpool by visiting Whirlpool Careers. Additional information about the company can be found on Facebook, Twitter, LinkedIn, Instagram and YouTube.

At Whirlpool Corporation, we value and celebrate diversity. Whirlpool Corporation is committed to equal employment opportunity and prohibits any discrimination on the basis of race or ethnicity, religion, sex, pregnancy, gender expression or identity, sexual orientation, age, physical or mental disability, veteran status, or any other category protected by applicable law.",unavailable,unavailable,"Weekends as needed, ",unavailable,test ,test3,03/06/2025,false,unavailable,100,https://www.indeed.com/rc/clk?jk=4eec72b2b1daa427&bb=dOl6zOEJ2hyMLdPFEMtoRv0brnwQyHicf7WceNga7EtWoxE3lFZwHhwbJyeiDSdPNL58m90Xej-ENZeKgSyv-3M7Dp3cd6cI20XOeQbLoTQBYIThJ6Gu-Q%3D%3D&xkcb=SoD367M3-QXVFsysTp1cbzkdCdPP&fccid=c403821dbe674a88&vjs=3
596daefe-7fee-4394-afa4-0a0851892fb0,"Risk Adjustment Educator - Denver, CO",https://www.indeed.com/rc/clk?jk=23a547c81c4fbb5f&bb=dOl6zOEJ2hyMLdPFEMtoRt4IfgWabVpvO8QDPzT3mwUmopun0ynZZuTdC8QchXbD4FYQc8FxM_jjA7mVUHdPXZ9bqbcRHA3JmXWaNRVZA4uExIuH0S15C5iwUxpFWO_t&xkcb=SoCq67M3-QXVFsysTp1SbzkdCdPP&fccid=0150f49158f48413&vjs=3,"Denver, CO",Physician Health Partners,https://www.indeed.com/cmp/Physician-Health-Partners?campaignid=mobvjcmp&from=mobviewjob&tk=1i2gfqgj6n8hs80g&fromjk=23a547c81c4fbb5f,15,"Are you looking to work for a company that has been recognized for over a decade as a Top Place to Work? Apply today to become a part of a company that continues to commit to putting our employees first.
Job Description:
Responsible for educating and advising providers and practice staff in Medicare coding guidelines, focusing on revenue enhancement opportunities. Work in collaboration with other PHP departments and Optum/United HealthCare Medicare Advantage(MA) or other health plans to develop plans and materials that support education and system changes to meet practice and IPA revenue goals.
COMPETENCIES/Role-Specific Functions:
COMMUNICATION
Communicates well both verbally and in writing, creates accurate and punctual reports, delivers presentations, shares information and ideas with others, has good listening skills.
Collaborates to develop plans and present to practices the HCC education program that reflects IPA ethical standards and Medicare guidelines.
Collaborate with Optum and PHP data analysts to develop meaningful practice-level reporting to assist in coding and code submission more effectively.
Work with contracted Medicare Advantage plans, Optum and other third party vendors to drive or supplement educational forums and reports.
PROBLEM SOLVING
Breaks down problems into smaller components, understands underlying issues, can simplify and process complex issues, understands the difference between critical details and unimportant facts.
Identify potential data flow obstacles within assigned practices and work with practice staff to develop action plans to assist practices in overcoming obstacles. Involve PHP Practice Transformation Coach to assist practices as needed.
Identify and solve issues with other vendors (billing companies, clearinghouse, etc.) to remove obstacles that prevent maximum code extraction and submission.
PRODUCTIVITY
Manages a fair workload, volunteers for additional work, prioritizes tasks, develops good work procedures, manages time well, handles information flow.
Risk adjustment chart reviews.
Educate physicians and office staff on coding techniques to accurately document and capture patient acuity to the highest degree of specificity while maintaining Medicare guidelines.
SELF DEVELOPMENT
Seeks out and accepts feedback, is a proactive learner, takes on tough assignments to improve skills, keeps knowledge and skills up-to-date, turns mistakes into learning opportunities.
Maintains working knowledge of changing health industry environment related to the risk adjustment model and CMS expectations such as tolerance, fraud/abuse responses, etc.
Remain current on CEUs to maintain CPC and other professional certifications.
CUSTOMER FOCUS
Builds customer confidence, is committed to increasing customer satisfaction, sets achievable customer expectations, assumes responsibility for solving customer problems, ensures commitments to customers are met, solicits opinions and ideas from customers, responds to customers.
Be a primary resource for physicians and office staff to answer questions or access resources to support documentation and coding for risk adjustment.
Interface with assigned practices on a regular basis to help develop and maintain engagement levels of practices.
Build relationships with practices to help them understand the importance of documentation and coding in a manner that addresses overall patient care management and IPA revenue goals.
JOB KNOWLEDGE
Understands duties and responsibilities, has necessary job knowledge, has necessary technical skills, understands company mission/values, keeps job knowledge current, is in command of critical issues.
Other duties as assigned.
Qualifications (Education/Experience/Knowledge/Skills/Abilities):
Bachelors’ degree in health related field required. Four years of related work experience may be considered in lieu of a degree.
Certified Professional Coder (CPC) required.
Certified Risk Adjustment Coder (CRC) required or commitment to get within 1 year of employment.
Three to five years’ experience with medical records and/or medical coding, preferably risk adjustment coding.
Knowledge of health care insurance claims practice and compliance.
Knowledge of Medicare rules and guidelines.
Knowledge of Claims Coding (CPT, HCPCs, ICD-10, HCFA 1500).
Knowledge of risk adjustment categories and hierarchy preferred.
Knowledge of MS Office Suite, Electronic Medical Records, Encoder, Coding Clinic, other software programs and internet based applications as needed to fulfill position duties.
Skilled in synthesizing data and questions to communicate a cohesive educational training program.
Skilled in responding to practice inquiries in a timely and accurate manner.
Skilled in working collaboratively with various parties to communicate an accurate and meaningful reporting package for practices.
Able to work effectively with physicians, practice staff, health plan/other external parties and PHP multidisciplinary team to streamline efforts to meet HCC Coding goals.
Able to work with sensitive data and relay potential issues or concerns in a diplomatic manner.
Able to multi-task and meet deadlines.
Able to work with external parties to obtain resources as needed.
Able to communicate findings in a clear, concise manner, both internally and externally, including presentations.
Required Licensure or Certification for this position must be maintained by the employee as defined by the company policies and procedures.
A valid unrestricted Colorado drivers’ license.
Reliable and insured vehicle.
Home office that is HIPAA compliant for all remote or telecommuting positions as outlined by the company policies and procedures.
Mobile Device for work purposes as defined by the company policies and procedures.
Physical Demands The physical demands described here are representative of those that must be met by an employee to successfully perform the essential functions of this job. Reasonable accommodations may be made to enable individuals with disabilities to perform the essential functions. While performing the duties of this Job, the employee is regularly required to sit; use hands to finger, handle, or feel and talk or hear. The employee is frequently required to stand; walk; reach with hands and arms and stoop, kneel, crouch, or crawl. The employee is occasionally required to climb or balance. The employee must regularly lift and/or move up to 25 pounds. Specific vision abilities required by this job include close vision and ability to adjust focus.
Work Environment The work environment characteristics described here are representative of those an employee encounters while performing the essential functions of this job. Reasonable accommodations may be made to enable individuals with disabilities to perform the essential functions. The noise level in the work environment is usually moderate.
Salary Range:
$58,510- 73,137",- Full-time,"$58,510 - $73,137 a year","$58,510 - $73,137 a year, ",unavailable,test ,test3,01/28/2025,false,unavailable,13,https://www.indeed.com/rc/clk?jk=23a547c81c4fbb5f&bb=dOl6zOEJ2hyMLdPFEMtoRt4IfgWabVpvO8QDPzT3mwUmopun0ynZZuTdC8QchXbD4FYQc8FxM_jjA7mVUHdPXZ9bqbcRHA3JmXWaNRVZA4uExIuH0S15C5iwUxpFWO_t&xkcb=SoCq67M3-QXVFsysTp1SbzkdCdPP&fccid=0150f49158f48413&vjs=3
