jobId,title,job_url,branch,company,company_url,review,description,type,salary,shift,benefit,category,subcategory,expire_at,is_claimed,average_rating,number_of_jobs,third_party_apply_url
2ddd220d-c39c-48f8-8419-1f6502a16a6b,Health Information Coder II - Health Information - F/T Days,https://www.indeed.com/rc/clk?jk=b501563142040b1e&bb=dOl6zOEJ2hyMLdPFEMtoRtHRtfXrcJHYbOpKHttX4dq_HlF98OS2Y85A2A3f17nlhLCIUPyeHFr4KR5q7ERSjVSolGnp9-d-uMXWwU_nHynw7WsvspqFNz8Add2JTXkK&xkcb=SoBk67M3-QXVFsysTp1CbzkdCdPP&fccid=576e1e9ae76b4557&vjs=3,unavailable,"University of California, Irvine",https://www.indeed.com/cmp/Uc-Irvine-Health?campaignid=mobvjcmp&from=mobviewjob&tk=1i2gfoa0pkhtq800&fromjk=b501563142040b1e,239,"Overview:
UCI Health is the clinical enterprise of the University of California, Irvine, and the only academic health system based in Orange County. UCI Health is comprised of its main campus, UCI Medical Center, a 459-bed, acute care hospital in in Orange, Calif., four hospitals and affiliated physicians of the UCI Health Community Network in Orange and Los Angeles counties and ambulatory care centers across the region. Listed among America’s Best Hospitals by U.S. News & World Report for 23 consecutive years, UCI Medical Center provides tertiary and quaternary care and is home to Orange County’s only National Cancer Institute-designated comprehensive cancer center, high-risk perinatal/neonatal program and American College of Surgeons-verified Level I adult and Level II pediatric trauma center, gold level 1 geriatric emergency department and regional burn center. UCI Health serves a region of nearly 4 million people in Orange County, western Riverside County and southeast Los Angeles County.
To learn more about UCI Health, visit www.ucihealth.org.
Responsibilities:
Position Summary:
Reporting to the Assistant Director of HIM for Operations, the Coder II performs abstracting and coding, using ICD-9 CM and CPT, on all outpatient visits (including ED, Ambulatory Surgery and clinic visits) at UCI Medical Center. Accounts are coded utilizing the 3M encoder and SMS/Invision computer systems for coding and data entry. Additional duties include preparing and compiling daily, weekly and monthly production reports, participating in departmental PI projects, and performing related duties as assigned to meet operational needs.
Qualifications:
Total Compensation
We offer a wealth of benefits to make working at UCI even more rewarding. These benefits may include medical insurance, sick and vacation time, retirement savings plans, and access to a number of discounts and perks. Please utilize the links listed here to learn more about our compensation practices and benefits.

Required Qualifications:
Skill, knowledge and ability essential to the successful performance of the job duties
Skill to effectively assign codes
Must possess the skill, knowledge and ability essential to the successful performance of assigned duties
Must demonstrate customer service skills appropriate to the job
Minimum one year of acute hospital coding experience
Knowledge of anatomy and physiology, disease process and medical terminology
Knowledge of ICD-9 CM and CPT coding
Knowledge of ICD-10 and CPT codes
Excellent written and verbal communication skills in English
Credentialed as CCS, CCS-P, CPC, or CPC-H
Ability to work independently and be a self starter
Ability to maintain a work pace appropriate to the workload
Ability to establish and maintain effective working relationships across the Health System

Preferred Qualifications:
Knowledge of University and medical center organizations, policies, procedures and forms

Conditions of Employment:
The University of California, Irvine (UCI) seeks to provide a safe and healthy environment for the entire UCI community. As part of this commitment, all applicants who accept an offer of employment must comply with the following conditions of employment:
Background Check and Live Scan
Legal Right to Work in the United States
Vaccination Policies
Smoking and Tobacco Policy
Drug Free Environment
The following additional conditions may apply, some of which are dependent upon business unit or job specific requirements.
California Child Abuse and Neglect Reporting Act
E-Verify
Pre-Placement Health Evaluation
Details of each policy may be reviewed by visiting the following page: https://hr.uci.edu/new-hire/conditions-of-employment.php

Closing Statement:
The University of California, Irvine is an Equal Opportunity/Affirmative Action Employer. All qualified applicants will receive consideration for employment without regard to race, color, religion, sex, sexual orientation, gender identity, national origin, disability, age, protected veteran status, or other protected categories covered by the UC nondiscrimination policy.

We are committed to attracting and retaining a diverse workforce along with honoring unique experiences, perspectives, and identities. Together, our community strives to create and maintain working and learning environments that are inclusive, equitable, and welcoming.

UCI provides reasonable accommodations for applicants with disabilities upon request. For more information, please contact UCI's Employee Experience Center (EEC) at eec@uci.edu or at (949) 824-0500, Monday - Friday from 8:30 a.m. - 5:00 p.m.",unavailable,Full-time,"Full-time, ","Benefits
Pulled from the full job description
Health insurance
Retirement plan
&nbsp;",test ,test3,12/30/2024,false,unavailable,701,https://www.indeed.com/rc/clk?jk=b501563142040b1e&bb=dOl6zOEJ2hyMLdPFEMtoRtHRtfXrcJHYbOpKHttX4dq_HlF98OS2Y85A2A3f17nlhLCIUPyeHFr4KR5q7ERSjVSolGnp9-d-uMXWwU_nHynw7WsvspqFNz8Add2JTXkK&xkcb=SoBk67M3-QXVFsysTp1CbzkdCdPP&fccid=576e1e9ae76b4557&vjs=3
69abbbc5-84d7-429a-b1ff-01f58d917078,Health Information Coder II - Health Information - F/T Days,https://www.indeed.com/rc/clk?jk=06d54fd0461e2055&bb=dOl6zOEJ2hyMLdPFEMtoRuK54g-ygCq9aBeZdmN-7j0ysn0JlhCESccSRd-anDrKZFsEe6TkE00USszwv1G3TCVKuTlhzQMnxMBiex-iW2R-AwRkslVshg%3D%3D&xkcb=SoDD67M3-QXVFsysTp1HbzkdCdPP&fccid=2ec9e0488117aa05&vjs=3,unavailable,"University of California, Irvine",https://www.indeed.com/cmp/Uc-Irvine-Health?campaignid=mobvjcmp&from=mobviewjob&tk=1i2gfor03mi0n800&fromjk=b501563142040b1e,239,"Overview:
UCI Health is the clinical enterprise of the University of California, Irvine, and the only academic health system based in Orange County. UCI Health is comprised of its main campus, UCI Medical Center, a 459-bed, acute care hospital in in Orange, Calif., four hospitals and affiliated physicians of the UCI Health Community Network in Orange and Los Angeles counties and ambulatory care centers across the region. Listed among America’s Best Hospitals by U.S. News & World Report for 23 consecutive years, UCI Medical Center provides tertiary and quaternary care and is home to Orange County’s only National Cancer Institute-designated comprehensive cancer center, high-risk perinatal/neonatal program and American College of Surgeons-verified Level I adult and Level II pediatric trauma center, gold level 1 geriatric emergency department and regional burn center. UCI Health serves a region of nearly 4 million people in Orange County, western Riverside County and southeast Los Angeles County.
To learn more about UCI Health, visit www.ucihealth.org.
Responsibilities:
Position Summary:
Reporting to the Assistant Director of HIM for Operations, the Coder II performs abstracting and coding, using ICD-9 CM and CPT, on all outpatient visits (including ED, Ambulatory Surgery and clinic visits) at UCI Medical Center. Accounts are coded utilizing the 3M encoder and SMS/Invision computer systems for coding and data entry. Additional duties include preparing and compiling daily, weekly and monthly production reports, participating in departmental PI projects, and performing related duties as assigned to meet operational needs.
Qualifications:
Total Compensation
We offer a wealth of benefits to make working at UCI even more rewarding. These benefits may include medical insurance, sick and vacation time, retirement savings plans, and access to a number of discounts and perks. Please utilize the links listed here to learn more about our compensation practices and benefits.

Required Qualifications:
Skill, knowledge and ability essential to the successful performance of the job duties
Skill to effectively assign codes
Must possess the skill, knowledge and ability essential to the successful performance of assigned duties
Must demonstrate customer service skills appropriate to the job
Minimum one year of acute hospital coding experience
Knowledge of anatomy and physiology, disease process and medical terminology
Knowledge of ICD-9 CM and CPT coding
Knowledge of ICD-10 and CPT codes
Excellent written and verbal communication skills in English
Credentialed as CCS, CCS-P, CPC, or CPC-H
Ability to work independently and be a self starter
Ability to maintain a work pace appropriate to the workload
Ability to establish and maintain effective working relationships across the Health System

Preferred Qualifications:
Knowledge of University and medical center organizations, policies, procedures and forms

Conditions of Employment:
The University of California, Irvine (UCI) seeks to provide a safe and healthy environment for the entire UCI community. As part of this commitment, all applicants who accept an offer of employment must comply with the following conditions of employment:
Background Check and Live Scan
Legal Right to Work in the United States
Vaccination Policies
Smoking and Tobacco Policy
Drug Free Environment
The following additional conditions may apply, some of which are dependent upon business unit or job specific requirements.
California Child Abuse and Neglect Reporting Act
E-Verify
Pre-Placement Health Evaluation
Details of each policy may be reviewed by visiting the following page: https://hr.uci.edu/new-hire/conditions-of-employment.php

Closing Statement:
The University of California, Irvine is an Equal Opportunity/Affirmative Action Employer. All qualified applicants will receive consideration for employment without regard to race, color, religion, sex, sexual orientation, gender identity, national origin, disability, age, protected veteran status, or other protected categories covered by the UC nondiscrimination policy.

We are committed to attracting and retaining a diverse workforce along with honoring unique experiences, perspectives, and identities. Together, our community strives to create and maintain working and learning environments that are inclusive, equitable, and welcoming.

UCI provides reasonable accommodations for applicants with disabilities upon request. For more information, please contact UCI's Employee Experience Center (EEC) at eec@uci.edu or at (949) 824-0500, Monday - Friday from 8:30 a.m. - 5:00 p.m.",unavailable,Full-time,unavailable,"Benefits
Pulled from the full job description
Health insurance
Retirement plan
&nbsp;",test ,test3,11/27/2024,false,unavailable,701,https://www.indeed.com/rc/clk?jk=06d54fd0461e2055&bb=dOl6zOEJ2hyMLdPFEMtoRuK54g-ygCq9aBeZdmN-7j0ysn0JlhCESccSRd-anDrKZFsEe6TkE00USszwv1G3TCVKuTlhzQMnxMBiex-iW2R-AwRkslVshg%3D%3D&xkcb=SoDD67M3-QXVFsysTp1HbzkdCdPP&fccid=2ec9e0488117aa05&vjs=3
828749fe-70c2-4528-b3be-11da5f08e604,Senior Controls Engineer,https://www.indeed.com/rc/clk?jk=da8cde9212eca423&bb=dOl6zOEJ2hyMLdPFEMtoRqkl5Kf3YPn4oxW2GvUlyTu3_AvHWfISU6a83CN0yfwy-4H7ETC5kgRvQif4hGL-Nc0H8NjlG6QELoZX7PyNrUgaWgUy898VPangJnkSLwIp&xkcb=SoDq67M3-QXVFsysTp1FbzkdCdPP&fccid=2766d6b42f2003bd&vjs=3,"Concord, NC","Celgard, LLC","https://www.indeed.com/cmp/Celgard,-LLC?campaignid=mobvjcmp&from=mobviewjob&tk=1i2gfp5smgo6e800&fromjk=da8cde9212eca423",101,"The Asahi Kasei Group operates with a commitment of creating for tomorrow. Our business sectors, Material, Homes, and Health Care, contribute to the development of society by anticipating the changing needs of those around the world. We look for candidates that offer a fresh perspective and a variety of skills to help us achieve our commitment.
We are currently seeking applications to fill the following job opening at Celgard where we develop and manufacture membrane battery separators that are critical components used in lithium-ion batteries for electric drive vehicles (EDVs) and energy storage systems (ESS).

Company:
Celgard, LLC
Job Description:
Senior Controls Engineer
Celgard – Concord, NC
About Us
For more than 50 years, Celgard has been a proven global leader in the development and production of high-performance membrane technology. Our products are used in a broad range of energy storage and other barrier-type applications, including lithium-ion batteries, lithium primary and other specialty battery solutions, technical textiles such as waterproof breathable apparel and medical personal protective equipment (PPE) and other specialty applications. Headquartered in the United States, we operate manufacturing facilities in the USA and China and have sales and technical service staff located strategically throughout North America, Europe, and Asia.
Celgard is part of Polypore International, a leading global high technology company specializing in microporous membranes. Polypore brings advanced development and manufacturing know-how as well as unique problem-solving capabilities to customers' lithium-ion and lead-acid battery development teams. Polypore is an Asahi Kasei Group company, which is a diversified group of companies led by holding company Asahi Kasei Corp., with operations in the material, homes, and health care business sectors. We are creating for tomorrow!
About the Role
We are seeking a Senior Controls Engineer to be a part of the Maintenance team based in Concord, NC. The Senior Controls Engineer is responsible for installing, modifying, and servicing process control systems throughout the facility as well as providing electrical engineering support that consist of electrical designs and drawings. He/she will work in a high performance, team-centered work environment to support operations, engineering, and maintenance by driving continuous improvement in the automation and control of the manufacturing processes as well as providing electrical engineering. Will utilize data management skills, PLC (Programmable Logic Control) skills, electrical engineering, and general troubleshooting skills to solve complex manufacturing processes, create enhancements to the process control systems, and provide electrical design solutions. Will assist with programming and installing of new equipment during start-up.
Reporting Relationships
This position directly reports to the Plant Maintenance Manager title here and does not supervise others.
Asahi Kasei’s Values
Sincerity – Being sincere with everyone
Challenge – Bolding taking challenges, continually seeking change
Creativity – Creating new value through unity and synergy
Key Accountabilities
Support equipment installation and modification in coordination with Project and Process Engineering initiatives.
Provide day-to-day support for all software and hardware that comprise the plant control network including: PLC’s, drives, switches, routers, PC diagnostic and repair, network IP, and industrial communication protocols.
Work closely with Manufacturing Technicians, Process Engineers, Project Engineers, and I&E (Instrumentation & Electrical) Technicians to provide advice and support, help diagnose PLC system and process issues, provide electrical design solutions, and lead troubleshooting efforts related to these systems.
Work with vendors of PLC hardware/software & SCADA software to troubleshoot and enhance the performance of equipment.
Work with suppliers of related instruments & electronic equipment related to the PLC equipment. Contact suppliers to clarify performance and application of PLC equipment, instruments, drives, and other equipment that is part of the control systems.
Work with SCADA supervisory systems to analyze process data and create process trend graphs.
Set up, modify, and analyze alarm & event display and archiving.
Participate on cross-functional continuous improvement teams. Lead and execute improvement projects to the automation & electrical systems. For larger projects using external resources, act as the plant automation liaison.
Maintain compliance with all plant safety systems and policies, and applicable laws/regulations.
Utilize lean manufacturing methodologies and problem solving/troubleshooting tools to identify root cause of problem areas in Process Control code, Operator Interface, or hardware and effectively resolve these problems with team member input. Specific troubleshooting and optimization activities will include reducing alarms and unplanned events, minimizing elements in manual, tuning controllers, evaluating the impact of automation systems on plant operability issues, participating in Root Cause Investigations, and utilizing tools such as SPC for optimizing plant Process Control systems.
Qualifications
Education Background:
Bachelor’s degree in Electrical Engineering or other related technical field.
Knowledge & Experience:
Minimum of 4-6 years’ experience with Rockwell (Allen Bradley) PLC programming & software analysis in a manufacturing environment
In-depth experience installing and supporting industrial control systems and control networks including: PLC’s, drives, switches, routers, PC diagnostics and repair, network IP, and industrial communication protocols
Proficiency with the following control methodologies required: PID loop configuration and analysis; sequential programming; temperature, pressure, and motor speed control
Highly proficient with the following software is required: RS 5000, RS500, and Panel builder
Experience programming and supporting the following platforms is preferred: Mitsubishi PLC’s; Rockwell GuardLogix; Wonderware or demonstrated ability on other high-level scripting language.
Advanced I&E skills
- Capable of using troubleshooting tools and techniques for diagnosing industrial machinery instrumentation. (i.e., Working knowledge of thermocouples, RTDs, pressure and flow transmitters, loops, SCRs and SSRs, encoders, ultrasonic sensors, limit and proximity sensors. Able to troubleshoot wiring from schematics and P&ID. Able to use multi-meters, amp meters, Fluke calibrator, oscilloscope, pressure calibrator, temperature bath)
AutoCAD experience
Able to read & edit P&ID drawings
Able to write technical communications including electrical and control drawings
Able to perform drive configurations and communication protocols associated with drive systems; troubleshoot drive systems
Key Attributes:
Able to work independently under limited supervision, and provide direction/leadership to others in automation tasks/projects
Strengths in organization and motivation
Excellent communication, teamwork, and interpersonal skills
Strong analytical skills to analyze process performance and recommend changes
Able to provide electrical and control design solutions for complex projects
Travel:
Must be able and willing to travel up to 10% for domestically and abroad for training and visiting other company locations
Working Environment
This position is in a manufacturing plant setting that would require working in a production environment around chemicals. Work will require standing and walking for up to 50% of the time. Lighting and temperature are adequate. You may be required to lift up to 35 pounds and/or force necessary to push, pull, or otherwise move objects.
Celgard manufacturing sites are IATF 16949 and ISO 9001 certified.
Location Information
Concord is part of the Charlotte metro area. Charlotte, NC, known as the Queen City, is a thriving metropolitan area of over 2.6 million people across 15 counties and is situated just north of the South Carolina border, within a weekend drive to the mountains and the beach. It is comprised of diversity in people, industries and living, from urban to rural. It is ranked second among 25 largest cities for most desirable place to purchase a home by Nerdwallet.com and is ranked eight among the top 10 big booming cities by CNNmoney.com. Charlotte is home of one of North Carolina’s largest college campuses, UNC Charlotte. Along with a friendly southern culture, Charlotte offers dining, arts, museums, major league basketball, football and soccer teams, a minor league baseball team, NASCAR, shopping, festivals, a variety of amenities and quick access to several parks and reserves for people who love the outdoors.
#LI-MN1
As an equal opportunity employer, Asahi Kasei believes a diverse workforce will provide us with the ability to continuously support the changes in the economy, society, and environment.",unavailable,Full-time,"Full-time, ",unavailable,test ,test3,12/21/2024,false,unavailable,15,https://www.indeed.com/rc/clk?jk=da8cde9212eca423&bb=dOl6zOEJ2hyMLdPFEMtoRqkl5Kf3YPn4oxW2GvUlyTu3_AvHWfISU6a83CN0yfwy-4H7ETC5kgRvQif4hGL-Nc0H8NjlG6QELoZX7PyNrUgaWgUy898VPangJnkSLwIp&xkcb=SoDq67M3-QXVFsysTp1FbzkdCdPP&fccid=2766d6b42f2003bd&vjs=3
a83e9da4-0c99-4267-b4af-b17d8b91ec61,Coding Auditor,https://www.indeed.com/rc/clk?jk=771c51ee55d34c24&bb=dOl6zOEJ2hyMLdPFEMtoRkZdQPVr0u6O2lqI65xNC8U5uIjy8_QPiL1OFaq71uBHCV5lfjF4cpSrqX_zNuex9r4cyX-JkHldPDusYVOAERZBWJ67Rod4wzykxGS-hCP9&xkcb=SoB567M3-QXVFsysTp1bbzkdCdPP&fccid=dd616958bd9ddc12&vjs=3,"Houma, LA 70360",unavailable,unavailable,unavailable,"Job Duties:

Develop and maintain physician audit plan to include a yearly review of:
a. Clinic and hospital EM services
b. Medical necessity issues with Denials and encounters no-billed
Perform coding and billing audits and provide written audit reports to administration and the providers.


Perform data analysis to ensure coding compliance of providers, including level of service analysis against Medicare and other pertinent benchmarks, i.e. MedAxiom and White Plume reports.


Develop and present educational materials, based on audit findings, to providers, management, coding and billing staff on correct coding guidelines and government policies per state regulations.


Develop policy guidelines and procedures in accordance with governmental regulations and the medical industry standards/practices. Research, develop and maintain documentation on coding guidelines for physician practices.
Maintain thorough knowledge of CMS/Medicare/Medicaid & private payer, NCDs, LA MC LCDs, documentation and coding rules for cardiology.
Prepare communications for practice administrators and others on identified issues and pertinent changes.
Act as liaison between business services and clinics on coding issues.

Job Requirements:

Bachelor of Science Degree or LPN and Certification as a Professional Coder.
Minimum of five (5) years experience.
Physician E/M coding and auditing experience preferred
Strong project management and presentation skills preferred.
Experience with Optum encoder, EMR and billing software preferred.

Standards of Performance:

1. Keeps work area neat and organized. Reports safety issues to team leader immediately.

2. Works efficiently and manages time wisely. Assist other employees when all duties are complete.

3. Communicates any problems, difficulties or concerns regarding job duties to the team leader.

4. Performs all duties without significant error occurring with any regularity.

5. Meets all deadlines and timeframes for completion of assignments.

6. Represents CIS in a professional manner at all times. Demonstrates acceptable ability to interact with physicians, staff (“internal customers”) and “external customers” (patients, family members, insurance companies, home health etc.) on a professional level at all times. Exhibits good communication skills with physicians, patients, team leaders, and co-workers at all times.

7. Exhibits whenever possible a harmonious relationship with other employees in order to accomplish the duties and responsibilities of the position. While perfect harmonious relationships with all employees are sometimes not achievable, not more than an occasional complaint should be received by the team leader about the incumbent of this position.

8. The employee shall work and relate cooperatively with all other employees (internal customers) to assure optimum care for the patients and to achieve standards of care set forth by the medical staff.

9. Adheres to the Compliance Plan as it pertains to the above specific job duties. Uses best efforts to maintain compliance by following the Corporate Compliance Plan, attending compliance education, following medical documentation guidelines, and communicating concerns regarding compliance issues.

10. Performs accurate and complete documentation in the patient’s medical record, when applicable.

11. Work with the electronic medical record (EMR) staff to maintain quality and work towards future EMR development.

12. Maintains patient confidentiality according to the HIPAA standards of privacy and security.",unavailable,Full-time,"Full-time, ",unavailable,test ,test3,12/31/2024,false,unavailable,unavailable,https://www.indeed.com/rc/clk?jk=771c51ee55d34c24&bb=dOl6zOEJ2hyMLdPFEMtoRkZdQPVr0u6O2lqI65xNC8U5uIjy8_QPiL1OFaq71uBHCV5lfjF4cpSrqX_zNuex9r4cyX-JkHldPDusYVOAERZBWJ67Rod4wzykxGS-hCP9&xkcb=SoB567M3-QXVFsysTp1bbzkdCdPP&fccid=dd616958bd9ddc12&vjs=3
